,기준뉴스문장,임계치문장,코사인유사도,클러스터갯수
2716,주호영 “李朴 반성하면 사면 이낙연 장난치지 마”…野 “비겁·잔인”종합,선수 뺏긴 국민의힘 ‘묵묵부답’…친이·친박은 사면 환영,0.7000007247741337,326
104,선수 뺏긴 국민의힘 ‘묵묵부답’…친이·친박은 사면 환영,주호영 “李朴 반성하면 사면 이낙연 장난치지 마”…野 “비겁·잔인”종합,0.7000007247741337,213
5599,해맞이 인파로 북적이는 잠수교,해돋이 보려고 호미곶 출입 통제 뚫어…포항 실시간 상황,0.7000007431702863,107
4717,해돋이 보려고 호미곶 출입 통제 뚫어…포항 실시간 상황,해맞이 인파로 북적이는 잠수교,0.7000007431702863,60
5634,청주 배터리 제조업체 불...인명 피해 없어,남양주 송라산 7부 능선서 불…인명 피해는 없어,0.7000012517155088,36
3584,남양주 송라산 7부 능선서 불…인명 피해는 없어,청주 배터리 제조업체 불...인명 피해 없어,0.7000012517155088,40
573,통합 명분으로 이명박·박근혜 사면 꺼낸 이낙연,뉴스추적 이재명 대세론 확산…이낙연 사면론 반성부터,0.7000014496975644,366
2648,뉴스추적 이재명 대세론 확산…이낙연 사면론 반성부터,통합 명분으로 이명박·박근혜 사면 꺼낸 이낙연,0.7000014496975644,57
4395,청주 교회관련 확진 어린이집 교사 접촉 원생 등 전원 음성,경기 군포시 공장 관련 신규 집단감염…67명 확진,0.7000017894119155,222
4178,경기 군포시 공장 관련 신규 집단감염…67명 확진,청주 교회관련 확진 어린이집 교사 접촉 원생 등 전원 음성,0.7000017894119155,354
2000,동부구치소 찾아 코로나19 현장 점검 나선 정세균 총리,현충원 참배 나선 문재인 대통령,0.7000023620675128,236
2276,현충원 참배 나선 문재인 대통령,동부구치소 찾아 코로나19 현장 점검 나선 정세균 총리,0.7000023620675128,348
3743,영상 “폴짝폴짝·쿵쿵”…정부 제작 ‘집콕댄스’ “세금 낭비” 뭇매,영상 드론 1000대가 쓴 희망 메시지···현대차 새해맞이 드론쇼,0.7000023727868839,21
4087,영상 드론 1000대가 쓴 희망 메시지···현대차 새해맞이 드론쇼,영상 “폴짝폴짝·쿵쿵”…정부 제작 ‘집콕댄스’ “세금 낭비” 뭇매,0.7000023727868839,39
7245,기재차관 올해 노동법제 개선 논의 빠르게 진화,세븐일레븐 기업문화 개선 ‘리스펙트7 캠페인’ 활동,0.7000032841660134,13
7996,세븐일레븐 기업문화 개선 ‘리스펙트7 캠페인’ 활동,기재차관 올해 노동법제 개선 논의 빠르게 진화,0.7000032841660134,20
1993,박형준 “국민통합·위기극복 위해 필요…문 대통령 前대통령 사면하길”,이낙연發 사면론에 정치권 발칵…반대 환영 불붙어,0.7000034792785201,230
2516,이낙연發 사면론에 정치권 발칵…반대 환영 불붙어,박형준 “국민통합·위기극복 위해 필요…문 대통령 前대통령 사면하길”,0.7000034792785201,333
943,묵념하는 김종인 비대위원장,새해 첫 현충원 찾은 이낙연 대표,0.7000035550798205,227
722,새해 첫 현충원 찾은 이낙연 대표,묵념하는 김종인 비대위원장,0.7000035550798205,225
6376,새해 첫날 인천신항한진컨테이너터미널,경남 새해 첫날부터 밤새 신규 확진자 13명 발생,0.7000038867803089,161
5302,경남 새해 첫날부터 밤새 신규 확진자 13명 발생,새해 첫날 인천신항한진컨테이너터미널,0.7000038867803089,451
4849,광주교도소 신입 수용자 1명 코로나19 확진으로 하루 만에 출소,서울서 코로나19 359명 신규 확진…17일 연속 300명대,0.7000048210441816,270
5283,서울서 코로나19 359명 신규 확진…17일 연속 300명대,광주교도소 신입 수용자 1명 코로나19 확진으로 하루 만에 출소,0.7000048210441816,453
1116,북한 경제난 속에도 화려한 신년 경축공연으로 새해 맞이,국방부 2021년 새해 맞이 대국민 영상 인사 공개,0.7000051295209242,71
1631,국방부 2021년 새해 맞이 대국민 영상 인사 공개,북한 경제난 속에도 화려한 신년 경축공연으로 새해 맞이,0.7000051295209242,44
5654,정동진에서 떠오르는 신축년 첫 태양,한반도 육지 첫 일출 울산 간절곶…썰렁한 해맞이,0.7000051954709369,109
5875,한반도 육지 첫 일출 울산 간절곶…썰렁한 해맞이,정동진에서 떠오르는 신축년 첫 태양,0.7000051954709369,162
4986,대구서 신규 확진 43명…교회·의료기관 관련 다수,동부구치소 누적 확진자 945명…직장·종교·요양시설 감염 확산종합,0.7000057239874479,368
3852,동부구치소 누적 확진자 945명…직장·종교·요양시설 감염 확산종합,대구서 신규 확진 43명…교회·의료기관 관련 다수,0.7000057239874479,226
2281,분향하는 문재인 대통령,문 대통령 한반도 대비태세 점검으로 새해 첫날 열어 경향포토,0.7000060759893338,205
405,문 대통령 한반도 대비태세 점검으로 새해 첫날 열어 경향포토,분향하는 문재인 대통령,0.7000060759893338,208
7339,포르쉐 르망 무대 복귀를 알리는 ‘LMDh’ 레이스카의 티저 이미지 공개,김정은 금수산태양궁전 참배로 올해 첫 공개 활동,0.70000739729983,36
1109,김정은 금수산태양궁전 참배로 올해 첫 공개 활동,포르쉐 르망 무대 복귀를 알리는 ‘LMDh’ 레이스카의 티저 이미지 공개,0.70000739729983,82
2138,속보 전국 아파트 편의시설·주민센터 문화교육강좌 중단,부산 29주 연속 아파트 가격 상승…기장군 급등,0.7000075905335784,10
5987,부산 29주 연속 아파트 가격 상승…기장군 급등,속보 전국 아파트 편의시설·주민센터 문화교육강좌 중단,0.7000075905335784,36
6196,서울동부구치소서 또다시 131명 무더기 확진,軍 내 코로나19 확산세 주춤…추가 확진자 0명,0.7000077921194741,332
2155,軍 내 코로나19 확산세 주춤…추가 확진자 0명,서울동부구치소서 또다시 131명 무더기 확진,0.7000077921194741,345
4503,신축년 새해 다시 시작이다,조선·해운 환경규제·해상운임 겹호재로 다시 뛴다,0.7000078864852033,43
7031,조선·해운 환경규제·해상운임 겹호재로 다시 뛴다,신축년 새해 다시 시작이다,0.7000078864852033,19
3757,울산 기독교 선교단체 관련 코로나19 10명 추가···누계 93명,확진자 941명 동부구치소발 감염자 더 나오나…내일 5차 전수검사,0.7000080863423019,441
3995,확진자 941명 동부구치소발 감염자 더 나오나…내일 5차 전수검사,울산 기독교 선교단체 관련 코로나19 10명 추가···누계 93명,0.7000080863423019,285
741,현충탑 참배하는 김종인 비대위원장,신년 인사말하는 김종철 대표,0.7000084143931771,337
595,신년 인사말하는 김종철 대표,현충탑 참배하는 김종인 비대위원장,0.7000084143931771,235
3469,기존 확진자 관련 3명·감염경로 미상 1명 추가…광주 누적 1106명,추미애 뒤늦게 SNS로 사과…동부구치소 확진자 945명,0.7000084558072667,473
3684,추미애 뒤늦게 SNS로 사과…동부구치소 확진자 945명,기존 확진자 관련 3명·감염경로 미상 1명 추가…광주 누적 1106명,0.7000084558072667,158
260,하태경 여야 합의로 두 전직 대통령 사면 공식 건의하자,이낙연 MB·朴 사면 언급에 야권 처음 듣는다..선거 이용 용납 못해,0.7000085167429437,209
907,이낙연 MB·朴 사면 언급에 야권 처음 듣는다..선거 이용 용납 못해,하태경 여야 합의로 두 전직 대통령 사면 공식 건의하자,0.7000085167429437,211
125,하태경 두 전직 대통령 사면 여야 합의로 공식 건의해야,이낙연 MB·朴 사면 언급에 야권 처음 듣는다..선거 이용 용납 못해,0.7000085167429437,209
7213,환경부 올해부터 하천·하구 쓰레기 강화 사업 확대,나재철 금투협회장 자금공급 강화 과세개선 지원,0.7000086373414863,28
8617,나재철 금투협회장 자금공급 강화 과세개선 지원,환경부 올해부터 하천·하구 쓰레기 강화 사업 확대,0.7000086373414863,21
108,이낙연 “이명박·박근혜 사면 건의”…첫날 ‘승부수’ 던졌다,野 사면론 경계…국정동력 떨어진 與의 선거용 카드,0.7000089206586919,389
41,野 사면론 경계…국정동력 떨어진 與의 선거용 카드,이낙연 “이명박·박근혜 사면 건의”…첫날 ‘승부수’ 던졌다,0.7000089206586919,31
593,중대재해기업처벌법 제정 촉구하는 김종철 대표와 단식농성단,정규재 민주당 2중대 국민의힘으론 정권교체 힘들어,0.700008937639349,119
1352,정규재 민주당 2중대 국민의힘으론 정권교체 힘들어,중대재해기업처벌법 제정 촉구하는 김종철 대표와 단식농성단,0.700008937639349,40
1009,이낙연 이명박·박근혜 사면 건의···野 선거에 이용하면 용납 못해,與 최고위 사면 당사자 반성 중요…이낙연 진영 넘어야종합,0.7000101083153417,352
2940,與 최고위 사면 당사자 반성 중요…이낙연 진영 넘어야종합,이낙연 이명박·박근혜 사면 건의···野 선거에 이용하면 용납 못해,0.7000101083153417,137
470,공군 항공통제기에서 보고받는 문재인 대통령,문 대통령 “느릿느릿 걸어도 황소걸음…일상 회복으로 보답” 새해 인사,0.7000104086302913,173
46,문 대통령 “느릿느릿 걸어도 황소걸음…일상 회복으로 보답” 새해 인사,공군 항공통제기에서 보고받는 문재인 대통령,0.7000104086302913,223
3701,동부구치소 재소자 확진 접촉자와 목욕에도 검사 안해줘…난장판,동부구치소 집단감염 국정조사 요구하는 국민의힘 법사위원,0.7000114986079844,79
2941,동부구치소 집단감염 국정조사 요구하는 국민의힘 법사위원,동부구치소 재소자 확진 접촉자와 목욕에도 검사 안해줘…난장판,0.7000114986079844,118
5354,속보 순천서 새해 첫날 일가족 6명 확진…누적 197명,신축년부동산③전문가 10명 중 9명 무주택자 올해 집 사라,0.7000116811134591,448
6772,신축년부동산③전문가 10명 중 9명 무주택자 올해 집 사라,속보 순천서 새해 첫날 일가족 6명 확진…누적 197명,0.7000116811134591,45
4643,1일 오전 11시 기준 추가확진자 없어…12월 31일 5명 추가 발생,고양서 미소아침요양병원 관련 7명 추가 확진…누적 109명,0.7000117756282375,151
3548,고양서 미소아침요양병원 관련 7명 추가 확진…누적 109명,1일 오전 11시 기준 추가확진자 없어…12월 31일 5명 추가 발생,0.7000117756282375,422
1105,김정은 신년사 대신 친필 연하장만 공개…“전체 인민에 감사”,떠나는 폼페이오 북미관계 자찬…강경화 장관에게도 “감사”,0.7000132349453718,116
2610,떠나는 폼페이오 북미관계 자찬…강경화 장관에게도 “감사”,김정은 신년사 대신 친필 연하장만 공개…“전체 인민에 감사”,0.7000132349453718,20
7895,경제전문가 현안설문 54% 올해 집값 더 오른다… 정부 공급 대책 효과에 의구심,경제전문가 현안설문 청년고용 늘리려면 규제 풀어 투자 활성화… 전국민 고용보험 무리,0.7000133013232871,40
7892,경제전문가 현안설문 청년고용 늘리려면 규제 풀어 투자 활성화… 전국민 고용보험 무리,경제전문가 현안설문 54% 올해 집값 더 오른다… 정부 공급 대책 효과에 의구심,0.7000133013232871,17
412,문재인 대통령 새해 첫날 공군 항공통제기 지휘비행 경향포토,문재인 대통령 현충원 참배 국민일상 되찾고 선도국가 도약,0.7000133605246317,179
1828,문재인 대통령 현충원 참배 국민일상 되찾고 선도국가 도약,문재인 대통령 새해 첫날 공군 항공통제기 지휘비행 경향포토,0.7000133605246317,340
1393,안철수 오늘 창신동 주거실태 점검…서울시장 후보 면모 부각,與후보 적합도 이재명·이낙연 順… 野선 윤석열·홍준표 順,0.7000135639344754,58
1518,與후보 적합도 이재명·이낙연 順… 野선 윤석열·홍준표 順,안철수 오늘 창신동 주거실태 점검…서울시장 후보 면모 부각,0.7000135639344754,28
865,박병석 국회의장 새해 첫 현충원 참배,文 현충원 참배…국민 일상 되찾고 선도국가 도약,0.7000138332904661,304
2036,文 현충원 참배…국민 일상 되찾고 선도국가 도약,박병석 국회의장 새해 첫 현충원 참배,0.7000138332904661,213
6649,12월 수출 12.6% 증가…지난해 총수출액은 5.4% 감소한 5천128억5천만달러,지난해 11월 전북 수출 5억 2천만 달러…전년 대비 0.7%↓,0.7000142299475022,90
6475,지난해 11월 전북 수출 5억 2천만 달러…전년 대비 0.7%↓,12월 수출 12.6% 증가…지난해 총수출액은 5.4% 감소한 5천128억5천만달러,0.7000142299475022,118
8572,신년사나재철 금투협회장 뉴딜펀드 활성화·퇴직연금 선진화 지원,농촌서 먼저 살아보기 전남도 귀농산어촌 지원책 다양,0.7000146578971675,24
5846,농촌서 먼저 살아보기 전남도 귀농산어촌 지원책 다양,신년사나재철 금투협회장 뉴딜펀드 활성화·퇴직연금 선진화 지원,0.7000146578971675,13
4960,새해 첫날도 썰렁…5인 이상 못 모여요,2021년 새 해 첫날도 세계 각국 코로나19 비상...8000만명 이상 확진,0.7000161311000812,10
4898,2021년 새 해 첫날도 세계 각국 코로나19 비상...8000만명 이상 확진,새해 첫날도 썰렁…5인 이상 못 모여요,0.7000161311000812,12
8233,디지털 엘도라도를 찾아서 비트코인 3만달러 돌파…개미들 채굴업체 주식 매수,자산시장 뒤흔드는 돈의 힘…美 주식 이어 부동산도 들썩,0.700017084472575,27
5950,자산시장 뒤흔드는 돈의 힘…美 주식 이어 부동산도 들썩,디지털 엘도라도를 찾아서 비트코인 3만달러 돌파…개미들 채굴업체 주식 매수,0.700017084472575,7
2768,문 대통령 동부구치소 관련해 ‘특별대책마련’ 지시,오죽하면 참모들이 대통령 얼굴에 침을 뱉었겠나,0.700017131793381,165
1399,오죽하면 참모들이 대통령 얼굴에 침을 뱉었겠나,문 대통령 동부구치소 관련해 ‘특별대책마련’ 지시,0.700017131793381,54
3866,동작구 산후조리원 관련 검사 결과 130명 전원 음성,속보충남 논산서 1명 확진…해외입국 내국인,0.7000174092813273,102
3497,속보충남 논산서 1명 확진…해외입국 내국인,동작구 산후조리원 관련 검사 결과 130명 전원 음성,0.7000174092813273,416
775,문 대통령 느릿느릿 걸어도 황소걸음...“새해 반드시 일상 되찾을 것”,현충원 참배 마친 문 대통령,0.700017601257373,209
2147,현충원 참배 마친 문 대통령,문 대통령 느릿느릿 걸어도 황소걸음...“새해 반드시 일상 되찾을 것”,0.700017601257373,331
1775,동부구치소 찾은 정총리 “초동대응 미흡…안타깝다”,TF포토 동부구치소 방문한 정세균추미애,0.7000180682738996,104
1777,동부구치소 찾은 정총리 초동대응 미흡…국민께 죄송종합,TF포토 동부구치소 방문한 정세균추미애,0.7000180682738996,104
2023,TF포토 동부구치소 방문한 정세균추미애,동부구치소 찾은 정총리 초동대응 미흡…국민께 죄송종합,0.7000180682738996,137
5699,2021년 전세계 덮친 코로나19 종식될까…벼랑끝 경제 회복은,코로나에 확장재정 불가피…부채관리에 韓경제 미래 달렸다,0.7000195105335694,18
6886,코로나에 확장재정 불가피…부채관리에 韓경제 미래 달렸다,2021년 전세계 덮친 코로나19 종식될까…벼랑끝 경제 회복은,0.7000195105335694,24
2049,코로나19 중대본 회의 발언하는 정세균 총리,정규재 민주당 2중대 국민의힘으론 정권교체 힘들어,0.7000195154629143,214
4808,작년 12월 수출 12.6% 증가 500억달러 돌파,작년 친환경차 판매 58% 늘었다…하이브리드·전기차 껑충,0.7000198264976055,137
7633,작년 친환경차 판매 58% 늘었다…하이브리드·전기차 껑충,작년 12월 수출 12.6% 증가 500억달러 돌파,0.7000198264976055,44
361,文 대통령 새해 첫날 한반도 2시간 ‘초계비행’···강한 안보 강조,새해 첫날 인하대 건물 화재 발생 2시간 20분만에 진화,0.7000200568892958,84
5309,새해 첫날 인하대 건물 화재 발생 2시간 20분만에 진화,文 대통령 새해 첫날 한반도 2시간 ‘초계비행’···강한 안보 강조,0.7000200568892958,72
7361,신규 확진 824명…남아공 변이 국내 첫 확인,입대 전수검사서 음성 받았던 육군 병사 1명 코로나19 확진,0.700020137587444,91
864,입대 전수검사서 음성 받았던 육군 병사 1명 코로나19 확진,신규 확진 824명…남아공 변이 국내 첫 확인,0.700020137587444,399
5689,울산 해맞이 명소 폐쇄에 생중계로 맞는 소띠 해,낯선 포항 호미곶 해맞이 광장,0.7000202275256583,89
5413,낯선 포항 호미곶 해맞이 광장,울산 해맞이 명소 폐쇄에 생중계로 맞는 소띠 해,0.7000202275256583,52
492,국민의힘 동부구치소 집단감염…재소자 인권 잊혀져,직장ㆍ교회 신규 집단감염 … 동부구치소 누적 945명,0.7000207970844242,102
3776,직장ㆍ교회 신규 집단감염 … 동부구치소 누적 945명,국민의힘 동부구치소 집단감염…재소자 인권 잊혀져,0.7000207970844242,441
6439,수출 25개월만에 500억달러 돌파…반도체 30% 급증종합,韓 중견기업 기술력 있어야 수출도 많이 한다,0.7000212510392502,83
8293,韓 중견기업 기술력 있어야 수출도 많이 한다,수출 25개월만에 500억달러 돌파…반도체 30% 급증종합,0.7000212510392502,17
4707,광주서 3일만에 두 자릿수 확진...누적 1098명,서울동부구치소 14명 추가 확진…2일 전수조사,0.700021721424598,265
6013,서울동부구치소 14명 추가 확진…2일 전수조사,광주서 3일만에 두 자릿수 확진...누적 1098명,0.700021721424598,416
5172,속보 순천서 일가족 등 6명 코로나 확진…학교서 전수검사,제주도 지난해 코로나19 환자 421명 발생,0.7000220835959396,437
4108,제주도 지난해 코로나19 환자 421명 발생,속보 순천서 일가족 등 6명 코로나 확진…학교서 전수검사,0.7000220835959396,147
2727,도미타 日대사 마지막 신년사 양국 과제 낙관주의와 인내로 해결해야,文대통령 새해 하산할까 정상 오를까…국민통합은 과제,0.7000223318159187,13
1496,文대통령 새해 하산할까 정상 오를까…국민통합은 과제,도미타 日대사 마지막 신년사 양국 과제 낙관주의와 인내로 해결해야,0.7000223318159187,15
3474,군포 피혁공장발 확진자 6명 추가 확진…직원·가족 등,강원 새해 첫날도 두 자릿수 확진…오늘 25명,0.7000224417741993,462
3314,강원 새해 첫날도 두 자릿수 확진…오늘 25명,군포 피혁공장발 확진자 6명 추가 확진…직원·가족 등,0.7000224417741993,250
3513,새해 첫날 충남·세종 등 10명 코로나 확진,코로나19 제주 5명 추가 발생…네오플 직원  전원 음성,0.7000225449791695,351
4624,코로나19 제주 5명 추가 발생…네오플 직원  전원 음성,새해 첫날 충남·세종 등 10명 코로나 확진,0.7000225449791695,366
1521,노영민 “대통령 제대로 보필 못해 죄송”,안철수 전 대통령 사면 건의 선거 이용 시도라면 용납 못 해,0.7000236501052481,20
565,안철수 전 대통령 사면 건의 선거 이용 시도라면 용납 못 해,노영민 “대통령 제대로 보필 못해 죄송”,0.7000236501052481,187
820,문 대통령 이명박·박근혜 전 대통령 사면 나설까,국민의힘 이낙연 ‘사면론 논란’에 내심 안도하는 까닭은,0.7000236923387803,277
2614,국민의힘 이낙연 ‘사면론 논란’에 내심 안도하는 까닭은,문 대통령 이명박·박근혜 전 대통령 사면 나설까,0.7000236923387803,294
2094,문대통령 국립서울현충원 방문해 신년 참배,윤한홍 국민의힘 경남도당위원장 국립3·15 민주묘지 참배,0.7000240760492064,261
3927,윤한홍 국민의힘 경남도당위원장 국립3·15 민주묘지 참배,문대통령 국립서울현충원 방문해 신년 참배,0.7000240760492064,142
6347,HMM 노사 새해 30분 남기고 파업 피했다…임단협 극적타결,새해 첫날 인하대 화재 학생들 떠나고 10여분 뒤 발생,0.7000250301081938,37
4022,새해 첫날 인하대 화재 학생들 떠나고 10여분 뒤 발생,HMM 노사 새해 30분 남기고 파업 피했다…임단협 극적타결,0.7000250301081938,60
3999,대목 잊은 강남역 거리,신규 확진자 다시 천 명대로...내일 거리 두기 조정 발표,0.7000252076741346,31
5192,신규 확진자 다시 천 명대로...내일 거리 두기 조정 발표,대목 잊은 강남역 거리,0.7000252076741346,107
842,신년인사회에서 발언하는 강은미 대표,코로나19 중대본 회의 발언하는 정세균 총리,0.7000267140901436,175
3169,익산 코로나19 확진자 3명 추가…누적 178명,잔인한 서울의 12월…한달 사망자 89명 111월만큼 숨졌다,0.7000270100990768,414
5627,군산서 코로나19 확진자 1명 추가…누적 124명,잔인한 서울의 12월…한달 사망자 89명 111월만큼 숨졌다,0.7000270100990768,414
3728,잔인한 서울의 12월…한달 사망자 89명 111월만큼 숨졌다,군산서 코로나19 확진자 1명 추가…누적 124명,0.7000270100990768,139
2385,文대통령 현충원 참배로 새해 업무 시작…국민 일상 회복,백군기 용인시장 현충탑 참배…“시민 삶의 질 향상시키겠다”,0.7000277749886974,298
1900,수봉공원 현충탑 참배하는 김홍희 해양경찰청장,文대통령 현충원 참배로 새해 업무 시작…국민 일상 회복,0.7000277749886974,235
4670,백군기 용인시장 현충탑 참배…“시민 삶의 질 향상시키겠다”,文대통령 현충원 참배로 새해 업무 시작…국민 일상 회복,0.7000277749886974,235
4366,현충탑 참배하는 김영록 전남지사,文대통령 현충원 참배로 새해 업무 시작…국민 일상 회복,0.7000277749886974,235
5161,충남 서천서 1명 확진…감염경로 조사중,신규확진 다시 1000명대…서울동부구치소 131명 추가 확진,0.7000277919846465,208
6128,신규확진 다시 1000명대…서울동부구치소 131명 추가 확진,충남 서천서 1명 확진…감염경로 조사중,0.7000277919846465,447
3753,코로나 확진자 1029명… 요양병원·노인시설·교회 집단감염,강릉 코로나19 115번째 확진자 발생,0.7000278169715753,428
62,강릉 코로나19 115번째 확진자 발생,코로나 확진자 1029명… 요양병원·노인시설·교회 집단감염,0.7000278169715753,105
1340,김정은 주민들에 친필 서한...새 시대 위해 힘차게 싸울 것,김정은 간결한 신년사에…1월 초순 열릴 당 대회에 더 시선 쏠린다,0.7000287910373496,117
2512,김정은 간결한 신년사에…1월 초순 열릴 당 대회에 더 시선 쏠린다,김정은 주민들에 친필 서한...새 시대 위해 힘차게 싸울 것,0.7000287910373496,55
2943,與지도부 李·朴 사면 당사자 반성 중요…국민·당원 의견수렴할 것,김종철 사면 최순실은 우상호 사과도 없는데…유승민 환영,0.7000288649084891,166
231,김종철 사면 최순실은 우상호 사과도 없는데…유승민 환영,與지도부 李·朴 사면 당사자 반성 중요…국민·당원 의견수렴할 것,0.7000288649084891,332
2511,이낙연發 사면론에 연초부터 정치권 발칵…野 당황 與도 시끌,이낙연 “적절한 시기 이명박·박근혜 사면 건의”…갑론을박,0.7000293323140188,203
25,이낙연 “적절한 시기 이명박·박근혜 사면 건의”…갑론을박,이낙연發 사면론에 연초부터 정치권 발칵…野 당황 與도 시끌,0.7000293323140188,371
56,친문 이낙연 용서 못해 잘가라...사면반대 국민청원 등장,이낙연發 사면론에 연초부터 정치권 발칵…野 당황 與도 시끌,0.7000296866576932,42
4744,광주교도소 신입수용자 1명 코로나19 확진돼 출소...불구속 수사,인천서 종교시설 집단감염 8명 포함 54명 확진,0.7000300783530002,266
4854,인천서 종교시설 집단감염 8명 포함 54명 확진,광주교도소 신입수용자 1명 코로나19 확진돼 출소...불구속 수사,0.7000300783530002,425
744,김종인 비대위원장이 현충원 방명록에 남길 글,신축년 첫 날 현충원 참배하는 박병석 의장,0.7000303895112701,180
858,신축년 첫 날 현충원 참배하는 박병석 의장,김종인 비대위원장이 현충원 방명록에 남길 글,0.7000303895112701,275
3582,병원에 리베이트 준 제약사 신고하고 보상금 2.3억,12월 수출 514억 달러 역대급 실적… 무역수지 8개월째 흑자,0.7000308770279307,27
