,기준뉴스문장,임계치문장,코사인유사도,클러스터갯수
8402,4월부터 지하역사 승강장 초미세먼지 농도 실시간 공개,LG전자의 세계 최초 롤러블폰 CES2021서 공개 전망,0.7015810522031405,22
8409,새해 금융권 코로나19 극복 한 목소리…언택트 시대 디지털 전환 화두,취임1년 맞이한 허태수 회장‥GS에 디지털 DNA 심었다,0.7015810978192999,29
6157,취임1년 맞이한 허태수 회장‥GS에 디지털 DNA 심었다,새해 금융권 코로나19 극복 한 목소리…언택트 시대 디지털 전환 화두,0.7015810978192999,23
2931,새해 되자 여야 후보 선출 방식 손보기,부산은 1·2위가 野후보 與김영춘 3위… 유권자 절반이 부동층,0.7015817718893343,14
1093,민주 온라인 단배식 개최 “文정부 성공·정권재창출 최선”,패션연 지역기업 온라인 판매지원 성과,0.7015836290241247,26
6726,패션연 지역기업 온라인 판매지원 성과,민주 온라인 단배식 개최 “文정부 성공·정권재창출 최선”,0.7015836290241247,15
1698,동부전선 GOP대대 찾은 서욱 국방부 장관,현충원 참배 참석한 변창흠 국토교통부 장관,0.7015855619700684,84
2104,이낙연의 MB·朴 사면론…정치권 술렁 사면반대 국민청원까지,박형준 이명박·박근혜 사면 환영···극단적 분열 정치 끝내자,0.7015857077351688,377
7809,설악산 오색케이블카 추가 인허가 절차 추진,靑 새 비서실장 ‘민생·경제·안정적 국정 추진’ 방점,0.7015882372242773,16
4106,부산에서 40명 확진...파랑새노인센터 관련 확진자 증가,지난 해 코로나19 5만 7042건 검사 … 확진자 총 421명 발생,0.7015900455163487,428
6936,신년사 이성희 농협중앙회장 제값에 팔고사는 유통개혁 최우선,신년사 전문장정민 인천시 옹진군수 “‘군민이 행복한 기회의 땅 옹진 건설을 위해 매진하겠다”,0.7015902921567746,26
2132,박형준 부산시장 적합도서 1위 달려,안철수 새해 서울시장 보궐선거 여론조사서 줄줄이 1위,0.7015904638200612,26
1878,안철수 새해 서울시장 보궐선거 여론조사서 줄줄이 1위,박형준 부산시장 적합도서 1위 달려,0.7015904638200612,46
3722,전광훈 “3·1절 1000만명 참여 국민대회” 또 대규모 집회 예고,SK이노 울산서 새해 일출 생중계…5200명 랜선 참여,0.701591206374618,9
3270,해남군 모레까지 해넘이·해맞이 명소 폐쇄,실종된 거리두기 잠수교는 해맞이 인파로 북적북적,0.701592402450537,62
8198,비트코인 상승세 어디까지 3만4000달러 돌파...또 사상 최고가,지난해 우리나라 사상 첫 인구감소…1인 세대 900만 돌파,0.701593363463901,70
5764,텅 빈 포항 호미곶 해맞이광장,신축년 새해 정동진 일출...해변엔 아무도 없었다,0.7015938509360582,109
7499,불매운동 약화·수출부진에 대일 무역적자 200억 달러 돌파,비트코인 3만3000달러 돌파 사상 최고가…테슬라 시총 코 앞까지,0.7015942597527285,59
4877,지방’ 빠진 서울경찰청,방명록 쓰는 서정협 서울시장 권한대행,0.7015955377481994,9
7420,파파존스 피자 사이드 메뉴와 콜라 구매 시 미트볼 페퍼로니 피자 30% 할인,30대 수입차 최다 구매 BMW 2030대에 인기,0.7015955697265022,37
8524,30대 수입차 최다 구매 BMW 2030대에 인기,파파존스 피자 사이드 메뉴와 콜라 구매 시 미트볼 페퍼로니 피자 30% 할인,0.7015955697265022,21
6282,각국 정상 2021년은 코로나 극복하는 희망의 해,2021년 새 해 첫날도 세계 각국 코로나19 비상...8000만명 이상 확진,0.7015975037150085,23
5643,해맞이 선유교 전면 통제,낯선 포항 호미곶 해맞이 광장,0.7015975897056294,73
208,뉴스1번지 문대통령 SNS로 국민들에 새해 첫 인사,문대통령 현충원 찾아 새해 각오…국민 일상 회복 선도국가,0.7015981935420439,38
2384,문대통령 현충원 찾아 새해 각오…국민 일상 회복 선도국가,뉴스1번지 문대통령 SNS로 국민들에 새해 첫 인사,0.7015981935420439,169
8314,코스피 시총의 25%는 삼성전자,삼성전자 ‘비스포크 인덕션’ 출시 국내 최고 화력,0.7015990418306337,21
3709,남원의료원 간호사 확진…전북 새해 첫날 6명 추가,입대 전수검사서 음성 받았던 육군 병사 1명 코로나19 확진,0.7015992005894273,382
4619,폭파 지령 받았다 난동부린 30대 구속,바위섬 오영훈 4·3특별법 반드시 처리하고 5대 공약 실현할 것,0.7015996361399424,41
1209,바위섬 오영훈 4·3특별법 반드시 처리하고 5대 공약 실현할 것,폭파 지령 받았다…청주서 흉기·방화 난동 30대 男 구속,0.7015996361399424,13
4956,폭파 지령 받았다…청주서 흉기·방화 난동 30대 男 구속,바위섬 오영훈 4·3특별법 반드시 처리하고 5대 공약 실현할 것,0.7015996361399424,41
3234,2021 새해 첫날 차분하고 한적…하늘에서 본 풍경,새해 첫날...코로나19로 분주한 의료진,0.7015997264306307,42
6602,日 번역 소설 ‘대망’ 재출간한 출판사 대표 유죄→무죄로 기사회생한 이유는,발언하는 김종철 대표,0.7016002144406154,13
773,미 재무부 테러지원국 북한 자산 4천448만 달러 동결중,인더머니 비트코인 3.3만 달러 돌파 최고가 ETF 나올까,0.7016002710570064,9
6781,신년사농협중앙회장 디지털 혁신이 농협의 미래 성장동력,신년사이낙연 코로나19 잡고 일류국가 만들자,0.7016010144357514,33
6026,자녀 아토피 보장·확정 연금액 평생 지급…보험사 신상품 경쟁,2021년 美·中 경제 패권 경쟁 재개…바이드노믹스 Vs 쌍순환 성장,0.7016011909986622,17
8733,2021년 美·中 경제 패권 경쟁 재개…바이드노믹스 Vs 쌍순환 성장,자녀 아토피 보장·확정 연금액 평생 지급…보험사 신상품 경쟁,0.7016011909986622,31
3748,추미애 아들 휴가 특혜 의혹 재수사…서울고검 “기록 검토중”,유승준 “난 병역면제자 추미애 한말씀하라” 또 분노 표출,0.7016023607841084,21
4114,유승준 “난 병역면제자 추미애 한말씀하라” 또 분노 표출,추미애 아들 휴가 특혜 의혹 재수사…서울고검 “기록 검토중”,0.7016023607841084,17
1959,서울동부구치소 현장점검 하는 정세균 총리,추미애 장관 교정시설 방문...긴급 실태 점검,0.7016026939871534,208
8443,정용진 부회장 신축년 인사는 하나도 안 닮은 제이릴라와 함께,산림청 세계산림총회와 함께 할 후원기업 모집,0.7016027989083277,13
7789,산림청 세계산림총회와 함께 할 후원기업 모집,정용진 부회장 신축년 인사는 하나도 안 닮은 제이릴라와 함께,0.7016027989083277,21
1386,속보 김정은 새해 맞아 주민들에 친필 서한 발표,김정은 올해 첫 공개활동...금수산태양궁전 참배,0.7016037238498557,116
5444,직원 때려 죽이고 7시간 방치한 응급구조사…아내와 동료도 범행 가담,우리은행 모바일·인터넷뱅킹 2시간 먹통…완전 복구됐다종합,0.7016037878852108,5
2369,정 총리 3차 유행 제압 시급…소중한 일상 되찾아드리겠다,정세균 지금은 대선주자라기보다는 총리. 책무 너무 막중한 상황,0.7016079142068666,75
390,그래픽 정부 부동산 정책 평가 10명 중 7명 잘못한다,“코로나19 여파 등 부산 호텔 노동자 5명 중 1명 실직”,0.7016081076963678,25
5547,소양강서 보는 첫해,해변 폐쇄에...도로에서 잠깐 일출만 볼게요,0.7016090967159039,28
7736,최고치 찍은 코스피 새해 3000선 직행하나,코스피 시총 GDP의 104% 추정,0.7016095095952974,27
3573,대법 오는 14일 국정농단 박근혜 두번째 판단,이낙연 박근혜 · 이명박 사면 카드…술렁이는 정치권,0.7016098420309609,26
4413,여름새 후투티 먹이 찾기 힘드네,‘골든타임’ 지났는데…제주 ‘명민호’ 실종 선원 6명은 어디에,0.7016101850678885,34
4372,‘골든타임’ 지났는데…제주 ‘명민호’ 실종 선원 6명은 어디에,여름새 후투티 먹이 찾기 힘드네,0.7016101850678885,32
708,반드시 일상 되찾을 것…박근혜이명박 사면 건의,원희룡 이낙연의 MB·朴 사면 여론 떠보기면 후폭풍 거셀 것 전문,0.7016152738275563,122
2463,북한도 백신개발 방역수칙 어기면 엄벌,모더나 5월부터 韓에 백신 공급…국내 접종 로드맵은,0.7016156072404776,27
3148,모더나 5월부터 韓에 백신 공급…국내 접종 로드맵은,북한도 백신개발 방역수칙 어기면 엄벌,0.7016156072404776,51
6588,‘최고의 무형 자산’ 퇴직 임원의 경험과 지식을 활용하라 김용우의 경영전략,2020 뉴욕증시 최고치 마감…다우·SP 천장 뚫었다,0.701616950888797,21
7262,세계 3대 차 부품업체는 왜 LG전자에 5000억을 투자했나 황정수의 반도체 이슈 짚어보기,작년 세계 5G 스마트폰 점유율 화웨이애플삼성 순,0.7016175161746748,15
4478,포토동대문구 해맞이 명소 배봉산에서 바라본 2021년 첫 해 유튜브 공개,신축년 새해 정동진 일출...해변엔 아무도 없었다,0.7016176233880707,117
6360,지난해 12월 최고 수출액 기록,지난해 11월 면세점 매출 1조4195억 원…한 달 만에 회복,0.701618767522676,137
8481,산업부 수소차 이차전지 등 31개 품목 관세율 0%로 인하,이재정 경기교육감 3월 6개 교육지원청에 미래국 신설,0.7016192342829036,25
7350,저무는 내연기관차…독일·일본 등서 車산업 해고 이어져,韓산업 대전환 ⑥ 산업재편 촉매제 한국판 뉴딜…위기를 기회로,0.7016205674163858,34
7273,韓산업 대전환 ⑥ 산업재편 촉매제 한국판 뉴딜…위기를 기회로,저무는 내연기관차…독일·일본 등서 車산업 해고 이어져,0.7016205674163858,17
6574,모더나 “올해 5월부터 한국에 백신 공급”,Tesla 18920대의 4분기 모델 SX 공급 보고,0.7016224451655296,63
7363,거리두기 단계 2주 연장…전국서 5인이상 모임금지,사회적 거리두기 2주 연장...코로나 검사 받는 시민들,0.7016227045751069,94
2275,국민의 일상을 되찾고 선도국가로 도약하겠습니다,문대통령 코로나로부터 자유로울 때까지 국민과 함께 걷겠다,0.7016243491235937,94
7413,중국 새해 첫날 코로나에 22명 감염·본토 8명...383명 치료중,서울 동부구치소 확진자 9백 명 넘어...요양시설도 감염 확산,0.7016263333067979,113
8496,새해 첫 행보로 민간외교 나선 허창수 회장,이성희 농협 회장 철저한 AI방역으로 확산 차단해야,0.7016295681292137,31
8031,이성희 농협 회장 철저한 AI방역으로 확산 차단해야,새해 첫 행보로 민간외교 나선 허창수 회장,0.7016295681292137,25
5119,‘전라감영 관찰사 밥상’ 전주 대표 음식 추진,홍천군 올해 ‘용문홍천 철도’ 사업 최우선 추진,0.7016316767570083,14
7808,홍천군 올해 ‘용문홍천 철도’ 사업 최우선 추진,‘전라감영 관찰사 밥상’ 전주 대표 음식 추진,0.7016316767570083,21
6375,12월 수출 최대 반등 12.6%상승..2020년 연간 5.4% 하락,2021년 키워드는 ‘초가속 시대’ ‘신흥국 반등’ ‘인플레이션의 귀환’,0.701632253134865,116
7047,2021년 키워드는 ‘초가속 시대’ ‘신흥국 반등’ ‘인플레이션의 귀환’,12월 수출 최대 반등 12.6%상승..2020년 연간 5.4% 하락,0.701632253134865,17
4136,전문 추미애 동부구치소 코로나 확산 늦은 사과,秋 동부구치소 첫 사과하면서 감염병 취약 구조물 탓,0.701633244127892,106
6031,지난해 주식 수익률 30% 안팎…달러는 ‘마이너스’,새해 달라지는 세금…부동산 세금 오르고 주식 거래세 내려,0.7016349675902965,18
7868,새해 달라지는 세금…부동산 세금 오르고 주식 거래세 내려,지난해 주식 수익률 30% 안팎…달러는 ‘마이너스’,0.7016349675902965,35
5900,강원도 새해부터 각종 수당 지원 확대,신년특집 이종석 산업부 산업기술시장혁신과장 새해 DX 적극 지원 계속,0.7016354826615254,29
8254,신년특집 이종석 산업부 산업기술시장혁신과장 새해 DX 적극 지원 계속,강원도 새해부터 각종 수당 지원 확대,0.7016354826615254,20
3170,구미서 새해 첫날 확진자 12명 추가…누적 253명종합,속보코로나19 국내 사망자 17명 늘어 누적 917명,0.7016357291973191,422
911,시선집중 지상욱 안철수 후보 단일화는 정치적 알박기 vs 홍익표 안철수 정치 공학만 남는 나쁜 폐해 반복하려,서울 안철수 26.2%·박영선 11.6%…부산 박형준 30.1%·김영춘 15.6%,0.7016357597974497,81
1771,중대재해법 촉구 단식 농성 23일…강은미 정의당 원내대표 병원 이송,코로나19 중대본 회의 발언하는 정세균 총리,0.7016366493363303,101
7396,동학개미의 힘…韓증시 시총 증가율 G20 중 中이어 2위,코스피 시총 GDP의 104% 추정,0.7016373653360065,30
455,문재인 대통령 신축년 첫날 군사대비태세 점검 지휘비행,성윤모 산업부 장관 새해 첫날 수출현장 점검,0.7016379496142213,193
4770,성윤모 산업부 장관 새해 첫날 수출현장 점검,문재인 대통령 신축년 첫날 군사대비태세 점검 지휘비행,0.7016379496142213,106
3261,생생정보 다슬기 닭백숙 직접 키운 토종닭과 섬진강 다슬기로 신선한 맛,문 대통령 동부구치소 수차례 특별 지시...국민의힘 직접 사과하라,0.7016398296627034,11
7082,기자수첩코스피 3000 시대 전제 조건,전기차 시대 막오른다…글로벌 車업체 총성 없는 전쟁,0.7016417543086197,18
7840,목소리만 듣고 범인 얼굴 그려낸다…AI 시대 성큼,전기차 시대 막오른다…글로벌 車업체 총성 없는 전쟁,0.7016417543086197,18
4035,기획칼럼 과학기술 시대 진심과 솔직함의 공동책임,전기차 시대 막오른다…글로벌 車업체 총성 없는 전쟁,0.7016417543086197,18
8242,2021 핫이슈국내마이데이터 시대 개막,전기차 시대 막오른다…글로벌 車업체 총성 없는 전쟁,0.7016417543086197,18
3708,안철수 차기 서울시장 우세에도 야권 단일화 필수인 이유,나경원 서울시장 출마 고심 중…최종적으로는 단일화가 맞다,0.7016430184611712,54
6082,나이·지역 가리지 않고…새해에도 집값 오른다,집값 안정이 최우선 과제,0.701643328112396,48
1663,서욱 국방부장관 세종대왕함 현장방문,성윤모 산업통상자원부 장관 수출 현장 방문,0.7016439254814273,81
1226,이낙연 대표 민주당 온택트 신년인사회에서 새해 인사말,뉴스1번지 민주 이명박ㆍ박근혜 사면 당사자 반성이 중요,0.7016440770535838,176
4490,속보 추미애 동부구치소 사태 뒤늦게 사과 “매우 송구”,秋 동부구치소 집단감염 ‘늑장사과’…첫 확진자 발생 35일만에,0.7016444947729694,94
5659,코로나19가 바꾼 해맞이,강릉 코로나19 초강수 효과…새해 해맞이객 전년 대비 90% 이상 줄어,0.7016453183674902,70
6048,서학개미 사로잡은 美 ESG ETF 올해도 高高할까,뉴욕증시 올해 마지막 거래일에 신고점…다우·SP500 장중 최고치,0.7016459741492055,29
6639,뉴욕증시 올해 마지막 거래일에 신고점…다우·SP500 장중 최고치,서학개미 사로잡은 美 ESG ETF 올해도 高高할까,0.7016459741492055,43
3151,한산한 명동거리 포토뉴스,새해 첫날 명동거리,0.7016500652180496,63
7090,브라질 증시 코로나 사태에도 연간 2.9%↑…5년 연속 상승,작년 한국 증시 45.6% 증가… G20 중 상승세 2위,0.7016505391393552,82
557,김종인 “사면 들은 바 없다”…안철수 “정치적 이용 용납 안돼” 강한 불쾌감,장제원 “이명박·박근혜 이낙연에 우롱 당해”,0.7016523009375555,60
6626,역대급 실적 12월 수출 514억 달러…반도체 30%↑상보,공시가 6억 변창흠 집보다 작은 옆집 15억 매물로 나왔다,0.7016540789461398,123
3326,대전 지인·가족 등 3명 추가확진…누적 859명,신규 확진 1029명 다시 1천 명대…사망 17명 늘어,0.7016541247656273,277
3789,휴일 한 컷새해 첫날 한산한 경복궁,새해 첫 날 한산한 서울 도심,0.7016552469840069,84
6729,美 증시 사상 최고치 작성하며 2020년 마감…연중 최저점 비교 66% 폭등,뉴욕증시 올해 마지막 거래일에 신고점…나스닥 연간 44% 급등 마감,0.7016575766449674,89
1641,신년사 김종인 국민의힘 비대위원장 잘못된 정치의 근본 바꿔야,사면론 vs 대국민 사과…수싸움 첫 승부에선 김종인 완승,0.7016598646816237,89
1643,신년사 김종인 국민의힘 비대위원장 잘못된 정치의 근본 바꿔야종합,사면론 vs 대국민 사과…수싸움 첫 승부에선 김종인 완승,0.7016598646816237,89
8629,신년 첫 일정 수출중기 찾은 홍남기 수출통한 반등 총력지원,1보 12월 수출 12.6%↑…작년 연간으로는 5.4%↓,0.7016603686417582,70
7703,PB칼럼 다가구주택을 양도하기 전에 반드시 확인할 사항,김종인 “보궐선거 반드시 승리…민주주의 바로 잡겠다”,0.7016604398412217,23
3907,재소자 가족 동부구치소에 재소자 확진 여부 확인해 달라 요청,국민의힘 법사위 동부구치소 집단감염 관련 국정조사 요구,0.7016604930073373,28
3552,서울시장 선거 운동 선점하는 안철수,연초부터 오신환·금태섭도…서울시장 선거 끓어오른다,0.7016609714451183,57
6776,2021년 신축년 새해 첫 아기 비대면 축하,새해 첫날 대입 정시전형 대비 비대면 상담,0.7016617889976859,68
7577,미 코로나 누적확진 2000만명 넘어… 백신접종 속도 거북이 왜,WHO 北 지난해 1만707명 코로나19 검사···확진자 0명,0.7016622285600946,10
3857,제주 강정마을 집단 거주지서 확진자 3명 발생,경기도 신규 확진 284명…사후 양성판정 등 사망자는 8명 늘어,0.7016642097239331,379
5943,감염 확산에 비대면 교육 가속… 에듀테크기업 ‘쑥쑥’ 2021신년특집코로나 시대 온라인 수업 활기,온라인 MRO 돌파구 삼을 것 적정가격·적재적소 배송 승부,0.7016648581605388,14
7934,온라인 MRO 돌파구 삼을 것 적정가격·적재적소 배송 승부,감염 확산에 비대면 교육 가속… 에듀테크기업 ‘쑥쑥’ 2021신년특집코로나 시대 온라인 수업 활기,0.7016648581605388,10
7475,작년 한국 증시 시가총액 증가율 G20 중 2위…중국 바로 뒤,올해 증시 백신V·바이든의 미국A·금리R에 달렸다,0.7016666419198528,38
5340,80일 전투 북한 축산물 생산서도 성과,80일 전투로 현대화 한 북한 병원 내부 모습,0.7016667982968483,79
3503,안전관리에 최선을 이일 인천소방본부장 취임 첫 현장 점검,군사대비태세 점검 지휘보고하는 이종문 연평부대장,0.7016688139207875,76
1472,이낙연 더불어민주당 대표 신년 인터뷰,이낙연 대표 새해 첫 현충원 참배,0.7016688456071344,147
7193,4일부터 베트남증권거래소 최소 거래단위 100주 KVINA,토요와이드 신규 확진자 824명…거리두기 2주 연장,0.7016693148527424,14
5663,직무태만 파면도 가능 충북교육청 징계기준 강화,직무태만·생활기록부 부정 등 중징계…충북교육청 처분 기준 강화,0.7016698606709759,14
4121,직무태만·생활기록부 부정 등 중징계…충북교육청 처분 기준 강화,직무태만 파면도 가능 충북교육청 징계기준 강화,0.7016698606709759,14
3177,제주 전복어선 실종선원 수색 계속…어선 스크루 부분 발견,제주 새해 첫날 확진자 9명 발생…누적 430명,0.701672225156423,41
4875,대구시·경상북도 두 지자체장 새해 시도민 위한 사업 협력 강화 약속...행정통합 의견 일치,유영민 “바깥 의견 전할 것”… ‘왕수석’ 신현수는 檢개혁 완수임무,0.7016726458113834,5
2107,유승민 구치소·요양원 코로나 방치…세월호 선장과 뭐가 다른가,野 동부구치소 사태 세월호 비교해 과실치사상 책임종합,0.7016743714058136,46
2183,유승민 文 구치소·요양원 코로나 방치…세월호 선장과 뭐가 다른가,野 동부구치소 사태 세월호 비교해 과실치사상 책임종합,0.7016743714058136,46
2119,국민의힘 與 동부구치소 코로나 확산 사과해야,심려 끼쳐 송구 秋 동부구치소 집단감염 첫 사과,0.7016756536947608,71
3243,심려 끼쳐 송구 秋 동부구치소 집단감염 첫 사과,국민의힘 與 동부구치소 코로나 확산 사과해야,0.7016756536947608,128
1967,정세균 총리 서울동부구치소 방문,동부구치소 찾은 정총리 초동대응 미흡 안타깝다,0.7016769325149023,180
1970,서울동부구치소 방문한 정세균 총리,동부구치소 찾은 정총리 초동대응 미흡 안타깝다,0.7016769325149023,180
1827,동부구치소 찾은 정총리 초동대응 미흡 안타깝다,서울동부구치소 방문한 정세균 총리,0.7016769325149023,121
3144,정부 내일 거리두기 단계 조정 확정 발표…외국인 입국자 PCR 음성확인서 제출 의무화,2일 거리두기 조정안…격상 없이 2.5단계 유지 가닥,0.701676949146336,102
3181,2일 거리두기 조정안…격상 없이 2.5단계 유지 가닥,정부 내일 거리두기 단계 조정 확정 발표…외국인 입국자 PCR 음성확인서 제출 의무화,0.701676949146336,42
7861,우체국예금 최고 연 1.3% ‘e공동구매 정기예금’ 출시,공유 킥보드 시즌권 등장 겨울 정기구독권 반값 ‘씽씽 겨울시즌 패스’ 출시,0.7016798359392259,21
6669,공유 킥보드 시즌권 등장 겨울 정기구독권 반값 ‘씽씽 겨울시즌 패스’ 출시,우체국예금 최고 연 1.3% ‘e공동구매 정기예금’ 출시,0.7016798359392259,26
1230,민주당 온택트 신년인사회에서 새해 인사말하는 이낙연 대표,민주 온라인 단배식 개최 “文정부 성공·정권재창출 최선”,0.7016826943516884,180
7015,돌고돌아 다시 강남… 12월 넷째주 0.1% 안팎 올라,불매운동 약화·수출 부진에 대일 무역적자 다시 200억 달러 돌파,0.7016834014340774,24
7491,불매운동 약화·수출 부진에 대일 무역적자 다시 200억 달러 돌파,돌고돌아 다시 강남… 12월 넷째주 0.1% 안팎 올라,0.7016834014340774,51
6521,3만달러 넘보는 비트코인…조만간 ETF 나올 듯,비트코인 3만3000달러 돌파…한국에선 더 비싼 3700만원,0.701683695201714,26
2015,정세균 총리 동부구치소 대책회의 주재,서울동부구치소 찾은 정세균·추미애,0.7016847113561409,201
8055,한국무역정보통신 임원 인사 단행…첫 여성 임원 발탁,인사 권준학 농협은행장 선임,0.7016864950834197,9
8689,김영란법 후 접대비 지출 3년만에 27%↓…농업인단체 “완화해달라”,뉴욕증시 장초반 하락세...상승 랠리 후 숨 고르기,0.7016878991903226,6
2239,헌화하는 문재인 대통령,文대통령 현충원 참배로 새해 업무 시작…국민 일상 회복,0.7016892898783779,184
2519,바이든 시대 다가오자 인도·태평양에 발담그는 유럽···왜,바이든 정부 곧 출범...비핵화 대화 어디로,0.701696139322594,17
1516,바이든 정부 곧 출범...비핵화 대화 어디로,바이든 시대 그린株가 뜬다…친환경·신재생에너지 담아라2021 유망주,0.701696139322594,14
6752,바이든 시대 그린株가 뜬다…친환경·신재생에너지 담아라2021 유망주,바이든 정부 곧 출범...비핵화 대화 어디로,0.701696139322594,17
6744,신년대담박영선 장관 소상공인 디지털화 이어 구독경제로 이끌 것,작년 이어 올해도···산업장관 새해 다짐은 “수출 플러스 전환” 뒷북경제,0.70169706431567,4
1942,새해 첫 방역조치 추가되고 빠진 것은…학원·스키장 운영 허용,새해 첫날 서울 확진자 최소 210명…동부구치소발 14명 추가,0.7016994745228939,14
7153,방문규 수출입은행장 수출 6천억 달러 탈환 교두보 마련,지난달 수출 12.6% 증가…역대 12월 최고 수출액 기록,0.7016998313793402,88
8528,식약처 소규모 식품업체 해썹 수수료 감면 연장,고양시 무료 임시선별검사소 17일까지 연장,0.7017002802332686,37
8359,권익위 지난해 1511건 고충 상담해 절반 넘게 해결,2021경제설문전문가 67% 정년 만65세로 연장해야…41% 저출산 해결 위해 보육 인프라 확충,0.7017060251798086,9
8461,2021경제설문전문가 67% 정년 만65세로 연장해야…41% 저출산 해결 위해 보육 인프라 확충,권익위 지난해 1511건 고충 상담해 절반 넘게 해결,0.7017060251798086,8
8251,신년특집 디지털 세정 한발짝...빅데이터·모바일서비스 역할 기대,2021년 모바일·디스플레이 경쟁 치열…차·조선 수요회복 기대,0.7017069876320445,14
4607,새해 첫날 전자출입명부 오류 긴급조치로 복구,새해 첫날 한산한 명동 거리,0.7017070574061067,54
