,기준뉴스문장,임계치문장,코사인유사도,클러스터갯수
513,2021년 군이 함께 하겠습니다…부여임무 완수,aT 스타트업 5개사와 함께 농식품 빅데이터 시동,0.7044810213716243,21
7274,2021 전망 ㊦ 전문가들 내년에도 집값 상승…민간 공급 늘려야,전국 집값 510% 상승… 전월세는 매매보다 더 오를것 2021 부동산시장 대전망,0.7044842269956817,30
132,대선 3강 윤석열에 정세균 尹 이름 빼달라고 해야 나도 뺐다,새해 대선후보 선호도 1위 이재명… 이낙연·윤석열과 3강,0.7044853188665819,51
7270,신축년 내 신용점수…이것만 해도 쑥쑥 올라간다,올해부터 가정폭력범 피해자 100m 내 접근금지,0.7044915903512379,12
5753,주가 조작해 번 만큼 벌금 법조항…헌재 합헌 결정,황소가 된 개미 주가 3000시대 연다,0.704496112580309,25
7520,연 1억 벌어도 신혼 특공 가능…올해부터 바뀌는 청약제도,건물주 文대통령 재산 19억 5천만원…부동산 폭등한 올해는,0.7044980100774374,6
4361,새해 첫 떡 드세요,새해 첫 날 한산한 강남역,0.7045001112120476,73
4340,새해 첫 손님 찾을까 문열어…막막해도 나아지겠지요,새해 첫 날 한산한 강남역,0.7045001112120476,73
3251,안녕하세요 새해 첫 월출입니다,새해 첫 날 한산한 강남역,0.7045001112120476,73
7721,부동산캘린더 새해 첫 청약…판교밸리자이 분양에 이목,새해 첫 날 한산한 강남역,0.7045001112120476,73
6171,올해 경제 3% 안팎 성장...코로나19 최대 변수,정유·화학 최악국면 지났지만…석유제품 수요 변수,0.7045015879395007,32
7030,정유·화학 최악국면 지났지만…석유제품 수요 변수,올해 경제 3% 안팎 성장...코로나19 불확실성 최대 변수,0.7045015879395007,11
6982,올해 경제 3% 안팎 성장...코로나19 불확실성 최대 변수,정유·화학 최악국면 지났지만…석유제품 수요 변수,0.7045015879395007,32
6298,12월 수출액 514억 달러…8개월 연속 흑자,한은 미리보기11월 경상수지 흑자 100억달러 또 넘을까,0.704518389463891,118
4064,청주 축전지 공장서 화재…3억3천만원 재산피해,청주 보육교사 관련 괴산서 1명 확진…누적 66명,0.7045204712320535,20
2758,동부구치소 누적확진자 1000명 넘어 野 文 사과하라 與 정치공세 안돼,영상국민의힘 법사위원들 동부구치소 집단 감염 윤석열 찍어내기만 골몰하다가...,0.7045216435646903,9
1091,북한 김정은 새해 첫날 신년사 대신 친필 서한,김정은 간결한 신년사에…1월 초순 열릴 당 대회에 더 시선 쏠린다,0.7045312499232554,129
7654,새해 맞아 결의 다지는 북한 철도국 노동자들,서욱 새해 맞아 경계작전 중인 육해공군·해병대 장병들과 통화,0.7045318216999619,25
4787,청와대 나온 노영민 전 비서실장 행보는…차기 선거 출마 주목,유은혜 부총리와 인사 나누는 유영민 비서실장,0.704536331658119,27
6938,존폐 위기 직면한 항공업계…구조재편은 속도,파업 위기 넘긴 HMM…체질개선해 안정적 수익 내자,0.7045383938460997,8
4909,서울녹색환경센터 초등생 온라인 환경교육 교재 제작,관동초 구은복 교사 소방청 온라인 안전교육 공모 최우수,0.7045395907405827,9
8037,‘김해율하 더스카이시티’ 3000억 원 PF 마무리…연초 착공 일반 분양 예정,2021년 새해 부산 아파트 신규 분양 2만 5천 가구 달해,0.7045407384718683,32
6779,신년사농식품부 장관 코로나 전쟁 승패 식량에 달려있어…농업이 곧 생명창고,박영선 장관 “코로나19 백신 주사기 준비 중”,0.7045425252403684,19
6763,“규제에도 잘나가”…올해도 부동산 상승 기대심리 여전,부동산 2021 대량공급 신호 나와야 가격 조정… 아니면 집값은 계속 오른다,0.7045431507694746,39
5126,산재 유가족 때밀이 발언해놓고 제소… 국힘 의원 언론탄압,청와대 “사면 제안 없었다”…친문 의원 “대통령 고심할 것”,0.7045479097737877,13
7190,부산 ‘일·생활 균형 지수’ 전국 3위,전국 요양병원 종사자 매주 진단검사…집단감염 고리 차단,0.7045518749616277,17
3588,아파트 자랑 좀 할게요…엘리베이터에 붙은 새해 덕담,대전·세종·충남서 아파트 4만 천 가구 분양,0.7045566538993828,21
5877,대전·세종·충남서 아파트 4만 천 가구 분양,아파트 자랑 좀 할게요…엘리베이터에 붙은 새해 덕담,0.7045566538993828,36
6214,통계 오류 논란 한국부동산원 내년 주택 통계 방법 확 바꾼다,아들·딸 판다 중고나라 패륜 게시물 논란,0.70455801194594,10
8185,아들·딸 판다 중고나라 패륜 게시물 논란,통계 오류 논란 한국부동산원 내년 주택 통계 방법 확 바꾼다,0.70455801194594,15
1732,인권변호사가 대통령인 나라 맞나 野 동부구치소 정부책임론,文정부 부동산정책 절반이상 낙제점 줬다,0.7045604559489188,15
4544,공항 입국 외국인 입국자 오는 8일부터 PCR 음성확인서 제출 의무화,공수처장 후보 의결 집행정지 오는 7일 심문,0.7045611026334683,63
5129,공수처장 후보 의결 집행정지 오는 7일 심문,공항 입국 외국인 입국자 오는 8일부터 PCR 음성확인서 제출 의무화,0.7045611026334683,18
2879,소상공인·특고 3차 재난지원금 지급 절차 착수… 11일부터 지급,3차지원금 지급 준비 착수…코로나 확산 속 세계은행 경제전망,0.7045675484999713,23
6909,재계 시무식도 언택트 대세…총수들 비장한 각오 내놓을 듯,코스피 시가총액 사상 최초 GDP 넘어선 듯,0.7045696779282282,22
3240,수도권 2.5단계 유지하면서 학원스키장 제한적 완화 검토,남양주 왕숙·고양 창릉 등 수도권 사전청약…오는 7월 개시,0.7045713412018517,53
4009,서울시립대 수도권생활치료센터 앞 구급차,신축년 새해... 임시선별진료소 앞 긴 줄,0.7045785474578392,15
4448,연합시론 추가 의사국시 허용 형평·공정 논란 해소할 노력 뒤따라야,석유협회 등유 공급 차질 관련 “생산 확대 등 적극 노력”,0.7045836978845705,6
7170,‘대게 싸네’ 포항 구룡포 대게값 하락세 주말 이후 오를듯,부산시민 43% 코로나19 확산 이후 소비 줄어,0.7045846351726138,7
5989,부산시민 43% 코로나19 확산 이후 소비 줄어,‘대게 싸네’ 포항 구룡포 대게값 하락세 주말 이후 오를듯,0.7045846351726138,16
7018,2021 경제기상도 코로나에 갇혔던 韓경제…소의 뿔처럼 저돌적 돌파 기대,경제전문가 현안설문 코로나 못지않은 역성장 주범 규제… 단 19%만 투자환경 개선,0.7045856179038053,29
5727,서양호 중구청장촘촘한 방역망 구축 코로나19 대응 선도,부산혁신원 동남권 미래 자동차 산업 상생 생태계 구축 시급,0.7045936709190078,27
5588,최북단 해산령에 떠오르는 붉은 태양,포토구름 사이로 솟은 새해 동해안 첫 일출,0.7045958050840615,90
5958,맥세스컨설팅 온라인으로 프랜차이즈 전문교육 받으세요,KTG 청년 창업·취업·문화 프로그램 온라인으로 전환 운영,0.704605653124093,10
605,신년인사회 인사말하는 강은미,신년특집 스마트공장으로 탈바꿈한 철강…스마트십 띄우는 조선,0.704610238381861,149
1171,뉴스하이킥 변창흠의 시대 2021년 부동산 전망은,포커스 추가 상승이냐 조정 급락이냐…새해 증시 전망은,0.7046107077683483,12
7870,포커스 추가 상승이냐 조정 급락이냐…새해 증시 전망은,뉴스하이킥 변창흠의 시대 2021년 부동산 전망은,0.7046107077683483,6
6292,조선내화 업계 최초 품질검사에 AI 도입…중기부 KAMP 첫 성과,패션연 지역기업 온라인 판매지원 성과,0.7046119143051583,10
7459,예금보험공사 직무급제 확대 적용... 전체 급여 30%,환경부 올해부터 하천·하구 쓰레기 강화 사업 확대,0.7046131726762657,27
8235,카페베네 네이버페이로 첫 결제 시 포인트 2천원 적립,中 연구진 마스크 착용 시 플라스틱 흡입…그래도 써야,0.7046147093349927,5
8752,中 연구진 마스크 착용 시 플라스틱 흡입…그래도 써야,카페베네 네이버페이로 첫 결제 시 포인트 2천원 적립,0.7046147093349927,3
2656,美전문가들 北문제 바이든 정부에서 후순위로 밀릴 것,바이든 시대 맞은 2021년 한반도…운명의 출발점에 서다,0.7046244517372502,12
3346,염홍철 전 대전시장 코로나19 확진…황운하 의원 ‘자가격리’,서울중앙지검 확진자 접촉한 직원 10명 모두 음성,0.7046305571878442,28
1120,신년 축하 공연 펼치는 북한 공연단,북한 경제난 속에도 화려한 신년 경축공연으로 새해 맞이,0.704631034744096,87
3189,층간소음에 방역수칙 위반까지…복지부 코로나 집콕 영상 뭇매,북한도 백신개발 방역수칙 어기면 엄벌,0.7046410213037452,14
3964,송철호 코로나19 위기를 기회로 만드는 울산 만들겠다,최승준 정선군수 혁신 전략으로 살맛 나는 지역경제 만들겠다,0.704646662304283,18
3642,최승준 정선군수 혁신 전략으로 살맛 나는 지역경제 만들겠다,송철호 코로나19 위기를 기회로 만드는 울산 만들겠다,0.704646662304283,26
2635,바티칸 이달 중 백신 접종 개시…교황 접종 여부는 미공개,기업은행 1월 중 IBK미얀마은행 출범…3번째 해외법인 설립,0.7046483973022746,26
8355,기업은행 1월 중 IBK미얀마은행 출범…3번째 해외법인 설립,바티칸 이달 중 백신 접종 개시…교황 접종 여부는 미공개,0.7046483973022746,23
1688,서욱 장관 전방 GOP 등 찾아 장병 격려 매너리즘 경계해야,동부구치소 찾아 코로나19 현장 점검 나선 정세균 총리,0.7046500734073244,55
8230,수도권 3기 신도시 및 공공택지 내 3만 가구 7월에 사전청약 돌입,분양캘린더새해 첫째 주 전국 3622가구 분양…견본주택 3곳 개관,0.7046518360289752,25
1847,민주당 거리두기 2.5단계 연장 송구스러울 따름…함께 해달라,확진자 일주일 평균 1030명…내일 거리두기 조정 ‘재연장’ 무게,0.7046523811245966,94
3763,태권도장 관장들 집합금지만 한 달째…방역 기준 완화해달라,경주 건재상 화재…건물 한 동 전소,0.7046531396481308,12
7922,공정위 현대중·대우조선해양 결합 심사 지연…1분기 중 결론 전망,2021 전망 ㊤ 공급부족전세불안 여전…가격상승 전망도 최고치,0.7046543609616734,6
7385,2021 전망 ㊤ 공급부족전세불안 여전…가격상승 전망도 최고치,공정위 현대중·대우조선해양 결합 심사 지연…1분기 중 결론 전망,0.7046543609616734,29
6007,소득세율 인상 뒤 초고소득자 세부담 크게 늘어,철강조선업 후판 가격 협상 돌입… 인상 vs 동결 두고 기싸움,0.7046631778856206,10
7714,그래픽 1월 첫째 주 분양 캘린더,과천 지정타에 대출 70% 가능한 아파트 분양 떴다 부릿지,0.7046641373703685,33
4164,올해부터 달라지는 영사 제도는… 미필도 5년 복수여권 발급,김진하 양양군수 군민들의 일상이 달라지는 양양 만들겠다,0.7046688260311278,19
4842,컨테이너들 사이 지나가는 트럭,정세균 총리 3차 유행 제압 시급...다음 달부터 치료제 투입,0.7046692270450331,9
6332,하천·하구 쓰레기 정화 사업 확대…새해 물관리 정책 변화는,홍천군 올해 ‘용문홍천 철도’ 사업 최우선 추진,0.7046713141934695,11
4511,사진 일출은 포기 못해... 동해안에 모인 사람들,통제 풀린 선유교에서 일출 관람하는 시민들,0.7046729572724068,24
1097,지상욱 安의 野단일후보 주장은 정치적 알박기…역선택 당할 것,김종인 “사면 들은 바 없다”…안철수 “정치적 이용 용납 안돼” 강한 불쾌감,0.7046776361972199,15
2787,‘백신 책임론’ 휩쓴 정치권 관련입법 봇물,MB朴사면 반대 국민청원 동의 봇물 · 野 구치소 감염 책임회피 꼼수,0.704682786361503,12
1351,양정숙 의류 등 신변용품 관련 민원 5년간 1만 5721건,12월 코로나19 사망자 391명 1년간 917명 숨져…위중증 354명 최다,0.7046854390710701,5
7251,새해 달라지는 공정거래 제도…모바일상품권 유효기간 1년 이상으로,신축년 노동계 달라지는 것은...유급휴일 확대·국민취업지원제 등,0.7046877113644016,39
7722,미 항공사들 작년 38조원 손실…새해 여행회복 기대에 베팅,작년 12월 코스피 11% 상승…22년 만에 최고의 산타 랠리,0.7046889179773257,17
7537,판 커진 전기차…누가 승자 전기차 패권 누가 잡나,중국 전기차 4개월 연속 1위 훙광미니…중국 토종 브랜드에 쫓기는 테슬라,0.7046899174749252,30
6308,최태원 “사회와 공감하며 문제 해결하는 새 기업가 정신 필요”,하이트진로 엑스트라콜드 새 단장… 충성 고객 저격 나섰다,0.704702122910211,46
4801,포토 세밑에 손 맞잡은 권영진 대구시장·이철우 경북도지사,fn포토 원희룡 백신이 오고 코로나는 끝나는 해가 되기를,0.704712945141589,11
7832,새해부터 훨훨나는 비트코인…시총 테슬라 넘어서나,서학개미 몰려간 테슬라 주가 8배 애플 시총 1조달러 늘어,0.7047149549452032,11
899,文대통령 신년 메시지 새해엔 반드시 일상 되찾을 것,이제 ESG는 하면 좋은 것 아닌 반드시 해야 하는 것,0.7047192165548622,142
6545,지식산업센터 임대 관리 편해 투자자 사이에서 인기 높아… 장기 임대에 임대료 안 밀린다,“행정수도 이전 반대” 51.4%… ‘찬성’보다 11.6%p 높아,0.7047208152867213,8
6937,‘하얀 소의 해’ 달라지는 것들,민주당 흰 소띠의 해 신축년 새해 화상 단배식,0.704721648963913,48
1608,박병석 국회의장 정치권 민생·통합 위해 헌신해야,정치권 ‘센 언니’들의 장관 성적표는,0.704723567537564,52
1734,정치권 ‘센 언니’들의 장관 성적표는,박병석 국회의장 정치권 민생·통합 위해 헌신해야,0.704723567537564,10
2623,유승민 정인이 사건 부끄럽고 죄스러워..재발 방지가 개혁,유승민 “구치소 감염 방치한 文대통령 세월호 선장과 다를바 없어”,0.7047341112621397,45
6001,조현준 효성 회장 고객이 믿을 수 있는 브랜드 만들어야…투명 경영도 강조,수해 복구장에서 위문 편지 읽고 있는 북한 인민군,0.704735310598976,30
164,농성장서 새해 맞은 산재 유가족…남은 정치권 숙제는,이낙연發 전직 대통령 사면론 정치권 새해 벽두부터 시끌,0.7047447525152218,10
6589,국제유가 마지막 날 상승 마감… 금값도 25% 급등,새해에도 집값 상승 전망 나이·거주형태 가리지 않고 최고,0.7047466488909667,35
3396,해고된 청소노동자 부당해 농성…사측 무리한 요구종합,눈물이 얼어도 집단해고 해결 촉구,0.7047467172552441,28
2394,새해 첫 코로나19 중대본 회의를 시작하며,아시아나 새해 첫 운항…반도체 싣고 이륙,0.7047468879637607,52
3594,통제선 밖 북적북적…구멍난 해맞이 방역,주차장으로 변한 해맞이 명소 주변 도로,0.7047487438496997,21
5934,4분기 부진한 한국가스공사 올해는 정상화,美 다솜한국학교 이중언어로 배우는 한국 역사문화 교재 발간,0.7047502127118161,7
6877,닥터지 안건영 대표 빅데이터·AI 활용해 피부과학 확산,임영빈 前삼성생명 고문 삼성생명공익재단 대표,0.7047505064544972,5
3152,따져보니 살려주세요 팻말 처벌…방역 책임 더 클 수도,내부고발자 전보조치 뒤 회사가 한 일 우긴 대표…法 대표도 책임,0.7047548930560728,11
5111,내부고발자 전보조치 뒤 회사가 한 일 우긴 대표…法 대표도 책임,따져보니 살려주세요 팻말 처벌…방역 책임 더 클 수도,0.7047548930560728,11
7571,‘1개 공장서 1개 기업만 제조’···대구서 의료기기 규제 풀린다,청주 축전지 공장서 화재…3억3천만원 재산피해,0.70476667507185,32
4116,광주 지산2동 주민들 250년 당산나무에 뜨개옷 입혔다,KBS광주 신년 여론조사① 광주·전남 차기 대선후보 이낙연 43.4%로 1위,0.7047674228121703,21
4166,계속되는 코로나19 검사,동작구 산후조리원 관련 검사 결과 130명 전원 음성,0.7047684682852781,34
1344,북한날씨 새해 첫날 대부분 지역 맑음…혜산 낮 최고기온 14도,비디오머그 새해 첫날 아침 모습 모아봤습니다,0.7047739429004743,7
7621,DB그룹 제조업의 보루…파운드리 특수 DB하이텍을 보는 법 株포트라이트,TF초점 쉴 틈 없다 2021년 4대 그룹 총수 앞에 놓인 과제는,0.7047750937445679,12
3959,경주 메추리농장서 고병원성 AI 확진…가금류 이동 제한,경매브리핑‘1억대 아파트’ 경주 세정스위츠리버 25대 1,0.7047774882221478,74
5095,거창일반산업단지에 떠오르는 붉은 태양,구름 사이로 뜬 2021년 첫 해,0.704784849379989,84
4075,서천·태안 대설주의보…충남에 7㎝ 안팎 눈 쌓여,연말 강추위 연초에도 계속…서울 영하 9.8도·전국 곳곳 눈,0.7047889410987721,21
8107,‘처음 밟는 3000 시대’ 공매도·환율·동학개미에 달렸다,코로나 임팩트“원격이민과 로컬의 시대” 세계 석학들이 말하는 미래,0.7047891700119701,14
6127,신년사이주열 총재 금융안정 위험요인 점검강화…지급결제 역할·책임 명확화,부대 임무수행 현장 점검하는 공군참모총장,0.704789507185912,12
4303,비대면 새해 해맞이,메가마트몰 비대면 소비 트렌드에 온라인 쇼핑몰 새단장,0.7047922906584683,23
5044,메가마트몰 비대면 소비 트렌드에 온라인 쇼핑몰 새단장,비대면 새해 해맞이,0.7047922906584683,27
3752,학생들 떠나고 10분 뒤 경보음… 아찔했던 인하대 화재,새해 첫날 인하대 큰 불…다행히 인명피해 없어,0.704796644730239,60
7637,새해에는 정종순 장흥군수 군민이 행복한 4메카·4시티 구현,포커스 전세계 조용한 새해맞이…지구촌 시민들의 새해 소망,0.7047999282893622,3
4979,새해에도 바쁘게 움직이는 선별진료소,최대호 안양시장 1일 4곳 선별진료소 찾아 근무자들 격려,0.7048038294857705,14
6947,최초 최초 최초… 현대차가 수소연료전지의 산 역사인 이유,코스피 시총 사상 최초 GDP 넘어서나…1980조 원 기록,0.7048059325490027,13
1922,모두발언 하는 정세균 국무총리,동부구치소 찾은 정세균 추미애 앞에서 초동대응 미흡 안타깝다,0.7048091363204824,152
6278,신년사최태원 사회와 공감·문제 해결 노력하는 새 기업가 정신 필요한 때,주가조작 때 징역형·벌금형 동시 부과 합헌,0.7048100186278239,46
5395,주가조작 때 징역형·벌금형 동시 부과 합헌,신년사최태원 사회와 공감·문제 해결 노력하는 새 기업가 정신 필요한 때,0.7048100186278239,24
3912,새해 일출명소 썰렁…동해안 일부지역 북적,포토동대문구 해맞이 명소 배봉산에서 바라본 2021년 첫 해 유튜브 공개,0.7048113585543766,147
230,안철수는 왜 새해 첫날 창신동으로 갔나,새해 벽두부터 치고나가는 안철수 이대로 굳어지나,0.7048115813678896,9
1194,윤석열 ‘제3 후보’로 주목되는 이유 뉴스,“윤석열 대선 여론조사 이름 빼야…나도 뺐다” 정세균 한마디,0.7048133606404497,14
1722,유승민 구치소 코로나 방치 세월호 같다…신동근 도가 지나쳐종합,조은희 문재인 정부 동부구치소 생지옥 만든 슈퍼 전파자,0.7048146848889022,53
6679,오늘부터 어선·여객선·화물선 환경규제 강화 시행,성남시 전국 최초 취약노동자 위한 ‘일하는 시민 조례’ 시행,0.7048264087667956,23
6745,시장도 정부도 인정한 주인공 ‘동학개미’,“서울시장 野 뽑아 정부견제” 56.1% “與 택해 정부지원” 34.1%,0.7048284086043266,9
8566,7월 인천계양 시작으로 3기 신도시 사전청약 돌입,대전·세종·충남서 아파트 4만 천 가구 분양,0.704832191965951,19
2996,춘천시 ‘우리마을119’ 도입 추진,신년사 대한한의사협회 최혁용 회장 의료기기 사용 적극 추진,0.70484216725412,31
731,현충탑 나오는 김종인,국립현충원 참배하는 박병석 국회의장,0.7048470038911832,178
1649,사회적 거리두기 2주 연장...정치권은 사면 논란 가열,토요와이드 신규 확진자 824명…거리두기 2주 연장,0.7048511432979939,54
5769,제주 어선 실종자 찾기에 악전고투…선원 시신 1구 발견,대형선망 어선 100여 척 부산 출항,0.7048541689924623,43
4079,신년사 허주형 대한수의사회장 올바른 처방제 정착 위해 노력,北김정은 신년사 대신 친필서한…인민 위해 싸울 것종합,0.704854637531366,10
1610,신년사김종인 나라 극도로 혼란 수권정당 되기 위해 노력,北김정은 신년사 대신 친필서한…인민 위해 싸울 것종합,0.704854637531366,10
3895,새해 부동산 시장은,올해 부동산 시장 안정될까,0.7048666916381708,10
5904,2020년산 공공비축미 벼1등급 작년대비 14.3% 올라,서울 아파트 3.3㎡당 4000만원 돌파…27개월 만에 1000만원 더 올라,0.704874799974548,11
3421,신년사박승원 광명시장 새로운 일상으로의 대전환 해 만들겠다,정하영 시장 변혁과 혁신으로 행복도시 김포 만들겠다,0.7048765237171869,30
1702,서울시장 野 예비후보들 당 울타리 없애고 미스터트롯 경선 룰 촉구,장제원 선두에 안철수 당 울타리 버려야…안철수 힘 합해야,0.7048772923654962,13
8028,고삐풀린 비트코인…4천만원 육박 사상최고,동부구치소 등 전국 교정시설 확진자 1000명 육박… 내일 동부구치소 5차 전수조사,0.7048774662647107,6
3010,KBS광주 신년 여론조사② 공항 이전 광주·전남 책임론 ‘팽팽’…시도통합은 59% 찬성,국민의힘 “교정시설 집단감염 후진국형 참사” 秋 책임론 제기,0.7048781376632566,19
4270,“충분한 백신 도입·접종 전략 세워 대유행 막아야” 2021신년특집코로나 이겨내는 희망 백신,그래픽코로나 백신 접종 주안점은 긴급성 48.9% 안전성 47.8%,0.7048788978407388,13
319,文대통령 공군 피스아이 첫 탑승…한반도 안보점검,문대통령 신축년 첫날 초계비행…특이동향 있나 육해공 점검,0.7048903540690955,118
6060,사즉생 유통 오너들…더이상 물러설 곳이 없다,중국 CDC 변이 바이러스가 백신 효과 떨어뜨리는 증거 없다,0.7048961030545751,14
5892,중국 CDC 변이 바이러스가 백신 효과 떨어뜨리는 증거 없다,사즉생 유통 오너들…더이상 물러설 곳이 없다,0.7048961030545751,7
8730,환경부 환경교육종합계획 수립 발표,모바일상품권 유효기간 최소 1년…공정위 새해 달라지는 제도 발표,0.7048963989160797,14
8312,환경부 제4차 녹색제품 구매촉진 기본계획 발표,모바일상품권 유효기간 최소 1년…공정위 새해 달라지는 제도 발표,0.7048963989160797,14
7452,모바일상품권 유효기간 최소 1년…공정위 새해 달라지는 제도 발표,환경부 환경교육종합계획 수립 발표,0.7048963989160797,32
5081,신규확진 또 1000명대···당분간 거리두기 지속되나,속보 신규 환자 1029명...새해 첫날 다시 천 명대,0.704896612421735,26
3304,전북 밤사이 산발적 눈…주말 강추위 이어져,서울 신규 확진 359명…요양병원·교회 등 집단감염 이어져,0.704898613017786,14
2530,뉴시스 여론조사오거돈 시정운영 잘못했다 74.5%…진보층도 58.7%,여론조사 文 잘한다 41.3%  잘못한다 54%,0.7048996203695489,17
2526,뉴시스 여론조사박원순 시정운영 잘했다 42.8% vs 잘못했다 51%,여론조사 文 잘한다 41.3%  잘못한다 54%,0.7048996203695489,17
2525,뉴시스 여론조사부산시민 58.7% 가덕 신공항 찬성…실현 가능성엔 반반,여론조사 文 잘한다 41.3%  잘못한다 54%,0.7048996203695489,17
2655,MBN 신년여론조사 범야권 서울시장 후보적합도 안철수 1위,‘서울시장 진격’ 안철수 “文대통령 망나니 칼잡이 앞세워 법치파괴종합,0.7049050173936399,69
2467,여론조사 이재명 23.6%윤석열 18.5%이낙연 16.7%,3강 머리 향하는 이재명…윤석열 1525% 이낙연 1519%,0.7049150189720411,70
591,김미숙씨 올해는 중대재해기업처벌법 제정해야,코로나19 중대본 회의,0.7049150248182384,9
2055,코로나19 중대본 회의,김미숙씨 올해는 중대재해기업처벌법 제정해야,0.7049150248182384,67
8332,금감원 민원 회신 카톡으로 받는다,청년내일채움공제 1년 안에도 중도해지 환급금 받는다,0.704919476965724,16
7941,하루 전기 끊겼던 LG트윈타워 농성장…항의도 못하게 해,한 해 마지막날 직장 잃어…청소 노동자들 눈물의 호소,0.7049256249479223,21
