,기준뉴스문장,임계치문장,코사인유사도,클러스터갯수
4515,강추위 속 언 손 녹이는 의료진,강추위 뚫고 새해 첫 일출 감상,0.7005024153437472,58
1958,보호장갑 착용하는 정세균 총리,TF포토 정세균추미애 동부구치소 현장점검,0.700503028895108,167
1934,정세균 총리의 모두발언,TF포토 정세균추미애 동부구치소 현장점검,0.700503028895108,167
486,운영 마친 놀이터 살펴보는 안철수 대표,우리은행 거점점포·인근 영업점 협업 운영,0.7005042149052404,148
8455,우리은행 거점점포·인근 영업점 하나로 묶어 운영,운영 마친 놀이터 살펴보는 안철수 대표,0.7005042149052404,43
8520,우리은행 거점점포·인근 영업점 협업 운영,운영 마친 놀이터 살펴보는 안철수 대표,0.7005042149052404,43
803,국립현충원 참배하는 김종인 비상대책위원장,문재인 대통령 국무위원들과 국립서울현충원 참배,0.7005051081198267,299
2279,문재인 대통령 국무위원들과 국립서울현충원 참배,국립현충원 참배하는 김종인 비상대책위원장,0.7005051081198267,322
7710,닥터대디의 세이프키즈아이 팔꿈치 탈골 너무 걱정마세요,부동산 또 언급한 유시민 불로소득 더 과세해야,0.7005054851256066,18
8098,너무 비싼 美 불임치료…그 틈새 파고든 보험사 프로지니,부동산 또 언급한 유시민 불로소득 더 과세해야,0.7005054851256066,18
5924,부동산 또 언급한 유시민 불로소득 더 과세해야,너무 비싼 美 불임치료…그 틈새 파고든 보험사 프로지니,0.7005054851256066,29
4268,문 대통령 신년 지휘비행,文 신년 메시지 느릿느릿 걸어도 황소걸음 일상 회복으로 보답,0.7005062156234766,248
6118,로또청약 후보지는 어디…올 39만 가구 풀린다,7000만 달러 수출 신안천사김 ‘공로탑’,0.7005062507679818,26
8303,7000만 달러 수출 신안천사김 ‘공로탑’,로또청약 후보지는 어디…올 39만 가구 풀린다,0.7005062507679818,53
3209,1일 0시 0분 낙태죄 사망 죽은 법이 남긴 숙제들,“낙태죄 다시는 만나지 말자” ‘낙태죄 없는 2021년’ 맞는 여성들,0.700506465452518,11
5109,“낙태죄 다시는 만나지 말자” ‘낙태죄 없는 2021년’ 맞는 여성들,1일 0시 0분 낙태죄 사망 죽은 법이 남긴 숙제들,0.700506465452518,10
2840,사면론 던지고 이틀 만에 한발 물러난 이낙연…리더십 또 휘청,이낙연 李·朴 사면론에 與野 ‘우왕좌왕’…靑 ‘침묵’,0.7005065368429924,47
2832,이낙연 李·朴 사면론에 與野 ‘우왕좌왕’…靑 ‘침묵’,사면론 던지고 이틀 만에 한발 물러난 이낙연…리더십 또 휘청,0.7005065368429924,306
3433,새해 첫날 서울 코로나 신규 확진 196명,올해 국가공무원 6450명 선발…전년 대비 340명 늘어,0.700506544335887,437
5262,코로나19 신규확진 1029명 이틀만에 1000명대… 누적 사망자 917명상보,광주서 3일만에 두 자릿수 확진...누적 1098명,0.7005065594441836,373
2315,현충탑 참배 마친 문 대통령,이낙연 두 전직 대통령 사면 문 대통령에 건의하겠다,0.7005073670710088,352
7885,올 롯데홈·홈앤쇼핑 재승인…이완신·김옥찬 대표 시험대,바이오엔테크 CEO 초저온 보관 아닌 백신 올 여름께 나온다,0.7005090192698356,10
5969,바이오엔테크 CEO 초저온 보관 아닌 백신 올 여름께 나온다,올 롯데홈·홈앤쇼핑 재승인…이완신·김옥찬 대표 시험대,0.7005090192698356,9
4231,새해 첫날 인하대 화재 학생들 떠나고 10여분 뒤 공대 연구실서 발생,경남 새해 첫날부터 밤새 신규 확진자 13명 발생,0.7005101677958423,59
3416,김포서 확진자 접촉 등 8명 확진…누적 467명,청주 A교회 관련 14명째 확진…어린이집 2곳 검사 중,0.700510357031493,449
3393,부천 확진자 접촉 등 22명 확진…가족간 전염 15명,청주 A교회 관련 14명째 확진…어린이집 2곳 검사 중,0.700510357031493,449
4699,의령군 12억 원 들여 ‘농업인 지식정보실’ 만든다,주간실거래가아이파크삼성 50억 1위…10억 넘게 올랐네,0.7005115879059087,30
5511,코로나19 어제 1천29명 신규확진…거리두기 재연장 무게,3단계 요건 충족에도…수도권 거리두기 2.5단계 연장에 ‘무게’,0.7005116581600108,146
4046,3단계 요건 충족에도…수도권 거리두기 2.5단계 연장에 ‘무게’,코로나19 어제 1천29명 신규확진…거리두기 재연장 무게,0.7005116581600108,94
1980,서울동부구치소 찾은 정세균·추미애,정세균 총리 동부구치소 초동 대응 미흡 안타깝다,0.7005124912423843,89
8011,금감원 민원처리 결과 카톡으로 받을 수 있다,현대해상 최고감사책임자 전격교체… 금감원 출신 영입,0.700514131574559,16
7724,현대해상 최고감사책임자 전격교체… 금감원 출신 영입,금감원 민원처리 결과 카톡으로 받을 수 있다,0.700514131574559,16
315,유승민 전 대통령 사면 제안에 적극 동의…발언 진심이길,이낙연 국민통합 명분…“MB·박근혜 사면 건의”,0.70051446007328,162
5028,‘코로나 탓’ 제야의 종 타종 67년만에 현장행사 대신 영상 감상,8년만에 최고 점유율…현대차그룹 美서 코로나 뚫고 급성장,0.7005148444692726,11
6156,8년만에 최고 점유율…현대차그룹 美서 코로나 뚫고 급성장,‘코로나 탓’ 제야의 종 타종 67년만에 현장행사 대신 영상 감상,0.7005148444692726,9
2639,野 이틀 만에 사면 뒤집은 與 비겁하고 잔인…文 결자해지하라종합,사면론 한발 뺀 이낙연 “당사자 반성이 중요”,0.7005156878639298,13
2869,이낙연 이명박·박근혜 사면 반성 중요…대법 판결 기다려 보겠다,사면론 던지고 이틀 만에 한발 물러난 이낙연…리더십 또 휘청,0.7005158832139889,359
7682,새해 업종별 3대 키워드②식음료·외식업계 홈술·혼밥족 잡아라,경매브리핑‘1억대 아파트’ 경주 세정스위츠리버 25대 1,0.7005163465295839,24
6799,경매브리핑‘1억대 아파트’ 경주 세정스위츠리버 25대 1,새해 업종별 3대 키워드②식음료·외식업계 홈술·혼밥족 잡아라,0.7005163465295839,37
4528,정부 “8일부터 모든 외국인 코로나 음성확인서 제출해야”,제주 모든 공영관광지·자연관광명소 3일까지 ‘폐쇄’,0.700517741595834,64
4026,제주 모든 공영관광지·자연관광명소 3일까지 ‘폐쇄’,정부 “8일부터 모든 외국인 코로나 음성확인서 제출해야”,0.700517741595834,13
4305,2021년 새해 첫 태양,신축년 새해 정동진 일출...해변엔 아무도 없었다,0.7005177475858249,133
2190,국무위원들과 인사 나누는 추미애 법무부장관,현충원 참배위해 입장하는 문재인 대통령과 국무위원,0.7005182783563457,62
2241,현충원 참배위해 입장하는 문재인 대통령과 국무위원,국무위원들과 인사 나누는 추미애 법무부장관,0.7005182783563457,373
2217,현충원 찾은 文대통령 “국민 일상 되찾고 선도국가 도약”,국기에 경례하는 문 대통령,0.7005191165081303,214
4878,전국 지방경찰청 이름에서 ‘지방’이 빠진다.,충북 4년제 대학 등록금 전국 평균 웃돌아,0.7005198474685455,16
5884,충북 4년제 대학 등록금 전국 평균 웃돌아,전국 지방경찰청 이름에서 ‘지방’이 빠진다.,0.7005198474685455,15
8615,금융권 코로나 위기 속 디지털 전환·ESG 경영 ‘고삐’ 2021신년특집금융그룹 경영화두,은성수 금융위원장 “코로나19 위기 극복 최우선”,0.7005199878049829,29
7290,은성수 금융위원장 “코로나19 위기 극복 최우선”,금융권 코로나 위기 속 디지털 전환·ESG 경영 ‘고삐’ 2021신년특집금융그룹 경영화두,0.7005199878049829,19
3003,대전시 폐자재 야적장에서 불...4시간 넘게 진화 중,영월 상동성당서 불…인명피해 없어종합,0.7005205887238728,23
4245,영월 상동성당서 불…인명피해 없어종합,대전시 폐자재 야적장에서 불...4시간 넘게 진화 중,0.7005205887238728,70
7151,Mahindra 및 Mahindra Exec  향후 Ford와 협업할 수 있는 기회를 모색합니다.,靑 전직 대통령 사면에 이낙연 대표가 실제 건의해야 논의할 수 있는 문제,0.7005206956608293,15
6668,작년 11월 면세점 내국인 구매 712억 코로나 본격화 이후 최대,작년 12월 코스피 11% 상승…22년 만에 최고의 산타 랠리,0.7005216496283498,57
2129,야 부산시장 후보군 조속한 사면 촉구…여권 의도에는 온도차,불붙은 이명박·박근혜 사면론에 野 대권주자 환영…서울시장 출마 안철수는 ‘신중’,0.7005231991504759,24
617,사면 카드 꺼내든 이낙연에 靑도 응답…선거용 군불때기,유승민 이낙연 MB·朴 사면 건의에 적극 환영..진심이길 바라,0.7005233089800544,171
3979,직장·동호회서 잇단 신규감염…동부구치소 관련 누적 확진 945명,광주교도소 신입 수용자 1명 확진 출소…교정시설 추가 없어,0.7005235001370351,461
244,이낙연 ‘이명박·박근혜 사면론’에 민주당 당원 ‘술렁’,국민 통합 vs 촛불 민심 역행…사면론에 불붙은 민주당,0.700523747380269,394
5005,서울 신규확진 359명 동부구치소만 126명 감염…누적 2만명 육박,코로나 1029명 확진…하룻만에 다시 1000명대 사망 917명,0.700523817975596,423
4695,국정농단 박근혜 전 대통령 14일 대법원 두 번째 판단 나온다,이낙연 박근혜·이명박 전 대통령 사면 적절한 시기에 문 대통령에게 건의,0.7005239966126896,36
3456,서울동부구치소 확진자 14명 추가…秋 “국민께 심려 송구”종합,새해에도 이어지는 포항·구미 연쇄감염 … 경북 곳곳 24명 신규 확진,0.7005242590049722,453
7006,AI가 골라 때되면 온다 영양제 구독시대,2021년 신축년 제약업계 소띠 CEO가 뛴다,0.7005247698247156,9
6996,2021년 신축년 제약업계 소띠 CEO가 뛴다,AI가 골라 때되면 온다 영양제 구독시대,0.7005247698247156,23
4037,파랑새노인건강센터 14명 추가…부산서 40명 신규 확진종합,충주 연수동 교회 관련 10명째 확진…목사 일가족·신도 등,0.7005254121538967,431
7450,동부구치소 확진자 14명 증가…오늘 1128명 전수조사,잔인한 서울의 12월…한달 사망자 89명 111월만큼 숨졌다,0.700525693302571,453
337,직장동호회서 신규 감염…동부구치소 집단발병 확산 누적 945명,서울동부구치소 14명 추가 확진…2일 5차 전수조사 실시,0.7005259201172583,413
1680,동부구치소 찾은 정세균 추미애 앞에서 초동대응 미흡 안타깝다,인사하는 추미애 법무부장관,0.7005264196548983,188
2196,인사하는 추미애 법무부장관,동부구치소 찾은 정세균 추미애 앞에서 초동대응 미흡 안타깝다,0.7005264196548983,71
2671,민주 이명박·박근혜 사면 국민 공감대·당사자 반성이 중요,민주당이 꺼낸 1가구1주택법… 성난 민심에 기름 부었다,0.7005271229282738,307
8351,민주당이 꺼낸 1가구1주택법… 성난 민심에 기름 부었다,민주 이명박·박근혜 사면 국민 공감대·당사자 반성이 중요,0.7005271229282738,27
721,문대통령 “미증유의 현실에 마주쳐 상생을 실천한 국민께 감사”,문대통령 느려도 황소걸음…한 사람 손도 놓지 않아 신년메시지,0.7005275533374578,30
1045,문대통령 느려도 황소걸음…한 사람 손도 놓지 않아 신년메시지,문대통령 “미증유의 현실에 마주쳐 상생을 실천한 국민께 감사”,0.7005275533374578,27
6556,신년사 김현수 농식품부 장관 “농업·농촌 희망 대안 찾겠다”,신년사이재갑 고용부 장관 30조 일자리예산 1분기 조기 집행,0.7005277933701952,28
5426,새해 첫 태양 기다리는 시민들,신축년 새해 정동진 일출...해변엔 아무도 없었다,0.7005285318398982,116
4,내세울게 없었나 北 김정은 신년사 187자 친필서한으로 대체,김정은 새 시대 위해 힘차게 싸울 것 신년사 대신 친필연하장 종합,0.7005285349484673,99
264,김정은 새 시대 위해 힘차게 싸울 것 신년사 대신 친필연하장 종합,내세울게 없었나 北 김정은 신년사 187자 친필서한으로 대체,0.7005285349484673,84
4206,신축년 새해 첫날 한산한 거리,한산한 호미곶 가는 도로,0.7005287441664355,140
5658,한산한 호미곶 가는 도로,신축년 새해 첫날 한산한 거리,0.7005287441664355,67
2663,박정훈 앵커가 고른 한마디 국민의 자랑이 되는 대통령,文대통령 국민과 함께 황소걸음…새해 반드시 일상 회복,0.7005287825895332,41
1021,文대통령 국민과 함께 황소걸음…새해 반드시 일상 회복,박정훈 앵커가 고른 한마디 국민의 자랑이 되는 대통령,0.7005287825895332,119
8453,사상 최고가 기록한 비트코인,비트코인 무서운 상승세…3700만원 선 돌파,0.7005289062421468,70
7968,비트코인 무서운 상승세…3700만원 선 돌파,사상 최고가 기록한 비트코인,0.7005289062421468,21
4427,먹이 찾는 인디언 추장 새 후투티,텅 빈 울산 간절곶서 떠오르는 신축년 해,0.7005290446239258,37
5532,속보신규확진 1029명…새해 첫날 다시 1000명대,속보 코로나 어제 1029명 신규확진…1000명대 재돌파,0.7005295539670042,110
714,취재진 질문에 답하는 이낙연 대표,신년사 이낙연 민주당 대표 사회갈등 완화 국민통합 이루겠다,0.7005299290958702,232
1729,추미애 재차 사과…동부구치소 집단 감염 국민께 송구,동부구치소 집단감염 한 달여 만에…추미애 사과,0.7005305784944583,118
3211,동부구치소 집단감염 한 달여 만에…추미애 사과,추미애 재차 사과…동부구치소 집단 감염 국민께 송구,0.7005305784944583,87
411,신년 지휘비행하는 문재인 대통령,문 대통령 “국민의 일상 되찾고 선도국가로 도약하겠다”,0.7005310749725876,215
2128,이낙연 李朴 사면론에 야권 환영 입장 잇따라…여권은 반대,이낙연 MB·박근혜 사면 건의…야 선거 이용 용납 못 해,0.7005323148594647,320
723,참배하는 이낙연 대표,이낙연이 띄운 ‘사면론…김종인 “처음 들어” 안철수 “선거용”,0.700532780698223,245
5412,코로나에 새해 첫 일출도 뺏긴 동해안,신축년 새해 해맞이객들로 북적이는 영일만항,0.7005336688685072,162
8544,신규확진 3주만에 600명대…5인이상 모임금지 효과낼까,광주 체육동호회 관련 신규 집단감염…22명 확진,0.7005336909325303,72
4139,광주 체육동호회 관련 신규 집단감염…22명 확진,신규확진 3주만에 600명대…5인이상 모임금지 효과낼까,0.7005336909325303,327
1805,화보 文 2일 현충원 찾아 추미애·탁현민 동행,현충원 참배하는 이수봉 민생당 비대위원장,0.7005351391586262,80
948,현충원 참배하는 이수봉 민생당 비대위원장,화보 文 2일 현충원 찾아 추미애·탁현민 동행,0.7005351391586262,357
947,현충원 참배하는 이수봉 비대위원장,화보 文 2일 현충원 찾아 추미애·탁현민 동행,0.7005351391586262,357
1374,김정은 새해 첫 공개행보로 금수산태양궁전 방문…노동신문 2면 보도,인민 위해 싸우겠다…北 김정은 새해 맞아 주민들에 친필 서한 발표,0.7005354993462837,84
1385,인민 위해 싸우겠다…北 김정은 새해 맞아 주민들에 친필 서한 발표,김정은 새해 첫 공개행보로 금수산태양궁전 방문…노동신문 2면 보도,0.7005354993462837,123
1029,文대통령 새해인사 “국민께 ‘일상의 회복’으로 보답할 것”,문 대통령 새해 맞아 국립현충원 참배,0.7005365181210729,130
2179,문 대통령 새해 맞아 국립현충원 참배,文대통령 새해인사 “국민께 ‘일상의 회복’으로 보답할 것”,0.7005365181210729,340
7652,사상 최악의 한 해 보낸 정유업…올해도 반전은 불투명,강경화 외교부 장관 “올 한 해 국민과 소통하며 최선 다하겠다”,0.7005369784435219,15
284,강경화 외교부 장관 “올 한 해 국민과 소통하며 최선 다하겠다”,사상 최악의 한 해 보낸 정유업…올해도 반전은 불투명,0.7005369784435219,19
5427,새해 첫 날 신규 확진자 1029명 이틀 만에 다시 1000명대,주말거리에서는확진자 900명대 정체…이번 주말 3단계 격상할까,0.7005383749172112,223
3546,이재정 경기도교육감 그린 스마트스쿨 추진 미래교육 의지,신년인터뷰 장충남 남해군수 실현 가능한 사업만 발굴 추진”,0.7005386827059732,31
5749,신년인터뷰 장충남 남해군수 실현 가능한 사업만 발굴 추진”,이재정 경기도교육감 그린 스마트스쿨 추진 미래교육 의지,0.7005386827059732,16
2109,그래픽서울시장 적합도 범여권 박영선 범야권 안철수,창신동 도시재생 구역 주민과 이야기하는 안철수,0.700540126838796,79
504,창신동 도시재생 구역 주민과 이야기하는 안철수,그래픽서울시장 적합도 범여권 박영선 범야권 안철수,0.700540126838796,89
305,유승민 이낙연 사면 제안…적극 동의하고 환영,이낙연 MB·朴 사면론에 與 내부 반발…부적절 난 반댈세종합,0.7005402968055388,320
160,이낙연 MB·朴 사면론에 與 내부 반발…부적절 난 반댈세종합,유승민 이낙연 사면 제안…적극 동의하고 환영,0.7005402968055388,217
2983,“산에서 커피 팔고 싶어” 조두순의 소박한 꿈 이뤄질까 시민들 ‘불안’,새해 첫 날 코로나19 검사 위해 줄 선 시민들,0.7005404887750802,58
5719,해맞이 풍경 극과 극,수원시 서장대 해맞이 명소 출입통제에 시민들 적극 동참,0.7005419588248731,80
4258,수원시 서장대 해맞이 명소 출입통제에 시민들 적극 동참,해맞이 풍경 극과 극,0.7005419588248731,104
4837,신축년 인천 송도 신항 힘찬 출발,새해 첫날...코로나19로 분주한 의료진,0.7005421429079491,53
4500,새해 첫날...코로나19로 분주한 의료진,신축년 인천 송도 신항 힘찬 출발,0.7005421429079491,138
1169,국민의힘 대통령야당 대표 단순한 만남은 의미 없어,전광훈 석방되자마자 대통령 비난 3·1절 국민대회 열겠다,0.70054231383264,25
8625,허창수 회장 한국계 美 하원의원에 무역확장법 개정 힘써달라,이갑종 오리엔트골프 회장 야마하 클럽 업계 첫 환불보증제 도입할 것,0.7005423637561151,21
7967,이갑종 오리엔트골프 회장 야마하 클럽 업계 첫 환불보증제 도입할 것,허창수 회장 한국계 美 하원의원에 무역확장법 개정 힘써달라,0.7005423637561151,18
3086,전북 환경개선 2766억 원 국고지원…지난해 대비 35%↑,새해 전기요금 고지서에 찍힌 1850원 뭐지,0.7005427442202163,29
7416,새해 전기요금 고지서에 찍힌 1850원 뭐지,전북 환경개선 2766억 원 국고지원…지난해 대비 35%↑,0.7005427442202163,17
732,현충탑 나오는 이낙연 대표,기자들 질문에 답하는 안철수,0.7005462816182841,230
745,기자들 질문에 답하는 안철수,현충탑 나오는 이낙연 대표,0.7005462816182841,163
4852,해맞이 명소 닫았더니...숨은 명소 찾아나선 시민들,새해 일출 인파 사라진 해운대,0.700547739273112,125
7265,수천억 금융사기 이철 전 VIK 대표 추가기소,민주 이낙연 대표 전 대통령 사면론에 갑론을박…촛불 민심 역행,0.7005478576356193,3
533,구치소 감염 이용구 이어 추미애도 사과 임기까지 최선,확진 1000명 목전에 두고서야...秋 “동부구치소 집단감염 송구”,0.7005485561375472,80
5463,코로나 확진자 또 1천 명대…내일 거리두기 단계 결정,수도권 거리주기 2.5단계 2주 연장,0.7005492989178419,102
5440,신규확진 1029명 이틀만에 1000명대…사망자 17명 늘어 총 917명,옥천 병원 직원 1명 코로나19 확진…환자 등 전수 검사,0.7005499057296907,439
652,현충탑 나서는 김종인 비상대책위원장,새해 첫 날 현충원 참배하는 서정협 서울시장 권한대행,0.7005503201011258,258
674,새해 첫 날 현충원 참배하는 서정협 서울시장 권한대행,현충탑 나서는 김종인 비상대책위원장,0.7005503201011258,227
128,하태경 여야 합의로 두 전직 대통령 사면 건의하자,원희룡 이낙연의 MB·朴 사면 여론 떠보기면 후폭풍 거셀 것 전문,0.7005522017502263,230
1892,원희룡 이낙연의 MB·朴 사면 여론 떠보기면 후폭풍 거셀 것 전문,하태경 여야 합의로 두 전직 대통령 사면 건의하자,0.7005522017502263,165
2320,문 대통령 새해 현충원 참배…국민 일상 되찾겠다,박은경 안산시의장 신축년 첫날 현충탑 참배,0.7005524766896404,316
8713,구독서비스 무료→유료 전환시 고지 의무화,조마조마한 1천 명대…내일 거리두기 재연장,0.7005537577644615,48
6076,아시아나항공 새해 첫 수출화물 ‘이륙’…“실적 향상 총력”,여랑야랑청와대의 ‘새해 첫 성적표’  더 바빠진 추미애,0.7005544849197789,31
4173,광주서 감염경로 미상 3명·병원 관련 1명 등 4명 추가…누적 1102명,속보 오후 6시 현재 서울서 코로나 확진 210명 발생,0.7005549548326155,453
8112,잠실·마포 2주택 종부세 단독명의 986만원공동명의 2300만원,300만원 내고 1200만원 받는 청년공제 10만명 선착순 접수,0.7005557047322332,16
8739,300만원 내고 1200만원 받는 청년공제 10만명 선착순 접수,잠실·마포 2주택 종부세 단독명의 986만원공동명의 2300만원,0.7005557047322332,27
1148,국기에 대한 경례하는 박병석 국회의장과 상임위원장들,현충탑 들어오는 김종인 비대위원장,0.7005557904452896,139
5465,2021년이 밝았습니다,강추위 속 언 손 녹이는 의료진,0.7005567147409117,37
3129,포커스 전세계 조용한 새해맞이…지구촌 시민들의 새해 소망,새해 일출 기념촬영,0.7005579734476076,48
5539,새해 일출 기념촬영,포커스 전세계 조용한 새해맞이…지구촌 시민들의 새해 소망,0.7005579734476076,96
3880,천리안 위성이 지켜봤다 한반도의 새해 일출,포커스 전세계 조용한 새해맞이…지구촌 시민들의 새해 소망,0.7005579734476076,96
4396,포토인사이트 새해 일출은 못참지,포커스 전세계 조용한 새해맞이…지구촌 시민들의 새해 소망,0.7005579734476076,96
4627,고향 떠난 통영시민에게 향인증 발급…관광지 14곳 할인,분양캘린더새해 첫째 주 전국 3622가구 분양…견본주택 3곳 개관,0.700558404026508,24
2947,정치실록 文대통령 구치소 현장 직접 점검하라···정치 공세 과도,문재인 대통령에 지휘보고 하는 이종문 연평부대장,0.7005584649605662,114
467,문재인 대통령에 지휘보고 하는 이종문 연평부대장,정치실록 文대통령 구치소 현장 직접 점검하라···정치 공세 과도,0.7005584649605662,161
464,문재인 대통령에 지휘보고 하는 오동석 22사단 GOP부대장,정치실록 文대통령 구치소 현장 직접 점검하라···정치 공세 과도,0.7005584649605662,161
5524,2보 코로나19 어제 1천29명 신규확진…다시 1천명대로,새해 첫날 신규 확진자 1029명…누적 61769명,0.7005588347037005,118
3518,태권도장들 집단감염 0명인데 한달째 셧다운…살 방법 달라,동부구치소 집단감염 국정조사 요구하는 국민의힘 법사위원,0.7005596702937352,17
1095,민주당 회복과 출발의 해…혁신 · 포용 · 평화 성과낼 것,민주 새해엔 코로나 위기 회복하고 발전의 초석 놓을 것,0.7005603554478076,25
1110,민주 새해엔 코로나 위기 회복하고 발전의 초석 놓을 것,민주당 회복과 출발의 해…혁신 · 포용 · 평화 성과낼 것,0.7005603554478076,18
816,이낙연 코로나에 빼앗긴 자유 되찾고 민생과 경제 살리겠다,하늘에서 본 새해 일출…코로나 넘어 경제도약 다짐,0.7005605164945006,28
6252,하늘에서 본 새해 일출…코로나 넘어 경제도약 다짐,이낙연 코로나에 빼앗긴 자유 되찾고 민생과 경제 살리겠다,0.7005605164945006,15
4042,경남에서 코로나19 확진자 28명 발생…도내 누적 1350명,코호트 격리 중인 진천 도은병원·음성 소망병원 14명 추가 확진,0.7005605225945841,454
561,문 대통령 국민 일상의 회복으로 보답,대구경북 시도민 76.5% 문 대통령 잘못…차기 대선후보 윤석열 검찰총장 45.4%,0.7005609310096425,212
7199,우리은행 모바일·인터넷 뱅킹 2시간동안 접속장애… “복구 완료”,FC안양 2021 시즌 코칭스태프 구성 완료,0.7005612532914203,49
3501,FC안양 2021 시즌 코칭스태프 구성 완료,우리은행 모바일·인터넷 뱅킹 2시간동안 접속장애… “복구 완료”,0.7005612532914203,6
7048,“억눌린 경제 하반기부터 분출” vs “과열 증시 거품 터지기 직전”,포토힘차게 비상하라 대한민국 경제,0.700561694546076,42
